k,noun,the basic unit of thermodynamic temperature adopted under the Systeme International d'Unites
k,noun,a light soft silver-white metallic element of the alkali metal group; oxidizes rapidly in air and reacts violently with water; is abundant in nature in combined forms occurring in sea water and in carnallite and kainite and sylvite
k,noun,the cardinal number that is the product of 10 and 100
k,noun,a unit of information equal to 1000 bytes
k,noun,a unit of information equal to 1024 bytes
k,noun,the 11th letter of the Roman alphabet
k,noun,street names for ketamine
k,s,"denoting a quantity consisting of 1,000 items or units"
ka,noun,unknown god; an epithet of Prajapati and Brahma
kaaba,noun,(Islam) a black stone building in Mecca that is shaped like a cube and that is the most sacred Muslim pilgrim shrine; believed to have been given by Gabriel to Abraham; Muslims turn in its direction when praying
kabala,noun,an esoteric or occult matter resembling the Kabbalah that is traditionally secret
kabala,noun,an esoteric theosophy of rabbinical origin based on the Hebrew scriptures and developed between the 7th and 18th centuries
kabalas,noun,an esoteric or occult matter resembling the Kabbalah that is traditionally secret
kabalas,noun,an esoteric theosophy of rabbinical origin based on the Hebrew scriptures and developed between the 7th and 18th centuries
kabbala,noun,an esoteric or occult matter resembling the Kabbalah that is traditionally secret
kabbala,noun,an esoteric theosophy of rabbinical origin based on the Hebrew scriptures and developed between the 7th and 18th centuries
kabbalah,noun,an esoteric or occult matter resembling the Kabbalah that is traditionally secret
kabbalah,noun,an esoteric theosophy of rabbinical origin based on the Hebrew scriptures and developed between the 7th and 18th centuries
kabbalahs,noun,an esoteric or occult matter resembling the Kabbalah that is traditionally secret
kabbalahs,noun,an esoteric theosophy of rabbinical origin based on the Hebrew scriptures and developed between the 7th and 18th centuries
kabbalas,noun,an esoteric or occult matter resembling the Kabbalah that is traditionally secret
kabbalas,noun,an esoteric theosophy of rabbinical origin based on the Hebrew scriptures and developed between the 7th and 18th centuries
kabob,noun,cubes of meat marinated and cooked on a skewer usually with vegetables
kabobs,noun,cubes of meat marinated and cooked on a skewer usually with vegetables
kachin,noun,Tibeto-Burman languages spoken in northernmost Burma and adjacent China and India
kachina,noun,a masked dancer during a Pueblo religious ceremony who is thought to embody some particular spirit
kachina,noun,a deified spirit of the Pueblo people
kachina,noun,a carved doll wearing the costume of a particular Pueblo spirit; usually presented to a child as a gift
kachinas,noun,a masked dancer during a Pueblo religious ceremony who is thought to embody some particular spirit
kachinas,noun,a deified spirit of the Pueblo people
kachinas,noun,a carved doll wearing the costume of a particular Pueblo spirit; usually presented to a child as a gift
kaffiyeh,noun,an Arab headdress consisting of a square piece of cloth folded into a triangle and fastened over the crown by an agal
kaffiyehs,noun,an Arab headdress consisting of a square piece of cloth folded into a triangle and fastened over the crown by an agal
kaffir,noun,important for human and animal food; growth habit and stem form similar to Indian corn but having sawtooth-edged leaves
kaffir,noun,an offensive and insulting term for any Black African
kaffirs,noun,important for human and animal food; growth habit and stem form similar to Indian corn but having sawtooth-edged leaves
kaffirs,noun,an offensive and insulting term for any Black African
kafir,noun,an offensive and insulting term for any Black African
kafir,noun,a member of the Kafir people in northeastern Afghanistan
kafiri,noun,a Dardic language spoken by the Kafir in northeastern Afghanistan
kafirs,noun,an offensive and insulting term for any Black African
kafirs,noun,a member of the Kafir people in northeastern Afghanistan
kafka,noun,Czech novelist who wrote in German about a nightmarish world of isolated and troubled individuals (1883-1924)
kafkaesque,adjective,relating to or in the manner of Franz Kafka or his writings
kafkaesque,s,characterized by surreal distortion and a sense of impending danger
kaftan,noun,a woman's dress style that imitates the caftan cloaks worn by men in the Near East
kaftan,noun,a (cotton or silk) cloak with full sleeves and sash reaching down to the ankles; worn by men in the Levant
kaftans,noun,a woman's dress style that imitates the caftan cloaks worn by men in the Near East
kaftans,noun,a (cotton or silk) cloak with full sleeves and sash reaching down to the ankles; worn by men in the Levant
kahikatea,noun,New Zealand evergreen valued for its light easily worked wood
kayak,noun,a small canoe consisting of a light frame made watertight with animal skins; used by Eskimos
kayak,verb,travel in a small canoe
kayaks,noun,a small canoe consisting of a light frame made watertight with animal skins; used by Eskimos
kayaks,verb,travel in a small canoe
kail,noun,a hardy cabbage with coarse curly leaves that do not form a head
kail,noun,coarse curly-leafed cabbage
kails,noun,a hardy cabbage with coarse curly leaves that do not form a head
kails,noun,coarse curly-leafed cabbage
kainite,noun,a white mineral consisting of magnesium sulphate and potassium chloride; a source of potassium salts; used as a fertilizer
kainites,noun,a white mineral consisting of magnesium sulphate and potassium chloride; a source of potassium salts; used as a fertilizer
kainogenesis,noun,introduction during embryonic development of characters or structure not present in the earlier evolutionary history of the strain or species (such as the addition of the placenta in mammalian evolution)
kayo,noun,a blow that renders the opponent unconscious
kayo,verb,knock unconscious or senseless
kayoed,verb,knock unconscious or senseless
kayoed,s,knocked unconscious by a heavy blow
kayoes,verb,knock unconscious or senseless
kayoing,verb,knock unconscious or senseless
kayos,noun,a blow that renders the opponent unconscious
kayos,verb,knock unconscious or senseless
kaiser,noun,the title of the Holy Roman Emperors or the emperors of Austria or of Germany until 1918
kaisers,noun,the title of the Holy Roman Emperors or the emperors of Austria or of Germany until 1918
kakatoe,noun,a genus of Psittacidae
kakemono,noun,a Japanese (paper or silk) wall hanging; usually narrow with a picture or writing on it and a roller at the bottom
kakemonos,noun,a Japanese (paper or silk) wall hanging; usually narrow with a picture or writing on it and a roller at the bottom
kaki,noun,small deciduous Asiatic tree bearing large red or orange edible astringent fruit
kaki,noun,blackish stilt of New Zealand sometimes considered a color phase of the white-headed stilt
kakis,noun,small deciduous Asiatic tree bearing large red or orange edible astringent fruit
kakis,noun,blackish stilt of New Zealand sometimes considered a color phase of the white-headed stilt
kalapooian,noun,a Penutian language spoken by the Kalapuya
kalashnikov,noun,a type of submachine gun made in Russia
kale,noun,informal terms for money
kale,noun,a hardy cabbage with coarse curly leaves that do not form a head
kale,noun,coarse curly-leafed cabbage
kaleidoscope,noun,a complex pattern of constantly changing colors and shapes
kaleidoscope,noun,an optical toy in a tube; it produces symmetrical patterns as bits of colored glass are reflected by mirrors
kaleidoscopes,noun,a complex pattern of constantly changing colors and shapes
kaleidoscopes,noun,an optical toy in a tube; it produces symmetrical patterns as bits of colored glass are reflected by mirrors
kaleidoscopic,s,continually shifting or rapidly changing
kaleidoscopical,s,continually shifting or rapidly changing
kales,noun,informal terms for money
kales,noun,a hardy cabbage with coarse curly leaves that do not form a head
kales,noun,coarse curly-leafed cabbage
kali,noun,bushy plant of Old World salt marshes and sea beaches having prickly leaves; burned to produce a crude soda ash
kali,noun,wife of Siva and malevolent form of Devi
kalian,noun,an oriental tobacco pipe with a long flexible tube connected to a container where the smoke is cooled by passing through water
kalians,noun,an oriental tobacco pipe with a long flexible tube connected to a container where the smoke is cooled by passing through water
kalif,noun,the civil and religious leader of a Muslim state considered to be a representative of Allah on earth
kalifs,noun,the civil and religious leader of a Muslim state considered to be a representative of Allah on earth
kaliph,noun,the civil and religious leader of a Muslim state considered to be a representative of Allah on earth
kaliphs,noun,the civil and religious leader of a Muslim state considered to be a representative of Allah on earth
kalis,noun,bushy plant of Old World salt marshes and sea beaches having prickly leaves; burned to produce a crude soda ash
kalis,noun,wife of Siva and malevolent form of Devi
kalmia,noun,any plant of the genus Kalmia
kalmias,noun,any plant of the genus Kalmia
kalumpang,noun,large tree of Old World tropics having foul-smelling orange-red blossoms followed by red pods enclosing oil-rich seeds sometimes used as food
kama,noun,Hindu god of love and erotic desire; opposite of Mara
kamas,noun,Hindu god of love and erotic desire; opposite of Mara
kamass,noun,Hindu god of love and erotic desire; opposite of Mara
kamba,noun,a Bantu language spoken by the Kamba in Kenya
kami,noun,"one the Shinto deities (including mythological beings, spirits of distinguished men, forces of nature)"
kamias,noun,a member of a North American Indian people of southeastern California and northwestern Mexico
kamias,noun,the Yuman language spoken by the Kamia
kamikaze,noun,a fighter plane used for suicide missions by Japanese pilots in World War II
kamikaze,noun,a pilot trained and willing to cause a suicidal crash
kamikazes,noun,a fighter plane used for suicide missions by Japanese pilots in World War II
kamikazes,noun,a pilot trained and willing to cause a suicidal crash
kamis,noun,"one the Shinto deities (including mythological beings, spirits of distinguished men, forces of nature)"
kampong,noun,a native village in Malaysia
kampongs,noun,a native village in Malaysia
kampuchea,noun,a nation in southeastern Asia; was part of Indochina under French rule until 1946
kanamycin,noun,antibiotic (trade name Kantrex) used to treat severe infections
kanara,noun,a historical region of southwestern India on the west coast
kanarese,noun,a member of a Kannada-speaking group of people living chiefly in Kanara in southern India
kanarese,noun,a Dravidian language spoken in southern India
kanawha,noun,a tributary of the Ohio River in West Virginia
kanchil,noun,small chevrotain of southeastern Asia
kangaroo,noun,any of several herbivorous leaping marsupials of Australia and New Guinea having large powerful hind legs and a long thick tail
kangaroos,noun,any of several herbivorous leaping marsupials of Australia and New Guinea having large powerful hind legs and a long thick tail
kannada,noun,a Dravidian language spoken in southern India
kansa,noun,a member of the Siouan people of the Kansas river valley in Kansas
kansa,noun,the Dhegiha dialect spoken by the Kansa
kansan,noun,a native or resident of Kansas
kansans,noun,a native or resident of Kansas
kansas,noun,a state in midwestern United States
kansas,noun,a member of the Siouan people of the Kansas river valley in Kansas
kansas,noun,a river in northeastern Kansas; flows eastward to become a tributary of the Missouri River
kansas,noun,the Dhegiha dialect spoken by the Kansa
kansas,noun,a member of the Siouan people of the Kansas river valley in Kansas
kansas,noun,the Dhegiha dialect spoken by the Kansa
kant,noun,influential German idealist philosopher (1724-1804)
kantian,adjective,of or relating to Immanuel Kant or his philosophy
kanzu,noun,(Swahili) a long garment (usually white) with long sleeves; worn by men in East Africa
kaoliang,noun,"sorghums of China and Manchuria having small white or brown grains (used for food) and dry pithy stalks (used for fodder, fuel and thatching)"
kaoliangs,noun,"sorghums of China and Manchuria having small white or brown grains (used for food) and dry pithy stalks (used for fodder, fuel and thatching)"
kaolin,noun,"a fine usually white clay formed by the weathering of aluminous minerals (as feldspar); used in ceramics and as an absorbent and as a filler (e.g., in paper)"
kaoline,noun,"a fine usually white clay formed by the weathering of aluminous minerals (as feldspar); used in ceramics and as an absorbent and as a filler (e.g., in paper)"
kaolines,noun,"a fine usually white clay formed by the weathering of aluminous minerals (as feldspar); used in ceramics and as an absorbent and as a filler (e.g., in paper)"
kaolinite,noun,a mineral consisting of aluminum silicate; main source of kaolin
kaolins,noun,"a fine usually white clay formed by the weathering of aluminous minerals (as feldspar); used in ceramics and as an absorbent and as a filler (e.g., in paper)"
kaon,noun,an unstable meson produced as the result of a high-energy particle collision
kaons,noun,an unstable meson produced as the result of a high-energy particle collision
kapeika,noun,100 kapeikas equal 1 rubel in Belarus
kaph,noun,the 11th letter of the Hebrew alphabet
kaphs,noun,the 11th letter of the Hebrew alphabet
kapok,noun,a plant fiber from the kapok tree; used for stuffing and insulation
kapok,noun,massive tropical tree with deep ridges on its massive trunk and bearing large pods of seeds covered with silky floss; source of the silky kapok fiber
kapoks,noun,a plant fiber from the kapok tree; used for stuffing and insulation
kapoks,noun,massive tropical tree with deep ridges on its massive trunk and bearing large pods of seeds covered with silky floss; source of the silky kapok fiber
kappa,noun,the 10th letter of the Greek alphabet
kappas,noun,the 10th letter of the Greek alphabet
kapuka,noun,small New Zealand broadleaf evergreen tree often cultivated in warm regions as an ornamental
kaput,s,destroyed or killed
karabiner,noun,an oblong metal ring with a spring clip; used in mountaineering to attach a rope to a piton or to connect two ropes
karakul,noun,hardy coarse-haired sheep of central Asia; lambs are valued for their soft curly black fur
karakuls,noun,hardy coarse-haired sheep of central Asia; lambs are valued for their soft curly black fur
karaoke,noun,singing popular songs accompanied by a recording of an orchestra (usually in bars or nightclubs)
karat,noun,the unit of measurement for the proportion of gold in an alloy; 18-karat gold is 75% gold; 24-karat gold is pure gold
karate,noun,a traditional Japanese system of unarmed combat; sharp blows and kicks are given to pressure-sensitive points on the body of the opponent
karates,noun,a traditional Japanese system of unarmed combat; sharp blows and kicks are given to pressure-sensitive points on the body of the opponent
karats,noun,the unit of measurement for the proportion of gold in an alloy; 18-karat gold is 75% gold; 24-karat gold is pure gold
karelian,noun,a member of the Finnish people living in Karelia in northwestern European Russia
karelian,noun,a Finnic language spoken by the people of Karelia
karen,noun,the Tibeto-Burman language spoken in the Thailand and Burmese borderlands
karyokinesis,noun,organic process consisting of the division of the nucleus of a cell during mitosis or meiosis
karyokinetic,adjective,of or relating to the division of the nucleus of a cell during mitosis or meiosis
karyolymph,noun,a clear liquid in the cell nucleus in which the nucleolus and chromatin and other structures are dispersed
karyolysis,noun,disintegration and dissolution of a cell nucleus when a cell dies
karyon,noun,a part of the cell containing DNA and RNA and responsible for growth and reproduction
karyoplasm,noun,the protoplasm that constitutes the nucleus of a cell
karyotype,noun,the appearance of the chromosomal makeup of a somatic cell in an individual or species (including the number and arrangement and size and structure of the chromosomes)
karma,noun,(Hinduism and Buddhism) the effects of a person's actions that determine his destiny in his next incarnation
karmas,noun,(Hinduism and Buddhism) the effects of a person's actions that determine his destiny in his next incarnation
kas,noun,unknown god; an epithet of Prajapati and Brahma
kasbah,noun,an older or native quarter of many cities in northern Africa; the quarter in which the citadel is located
kasha,noun,boiled or baked buckwheat
kashas,noun,boiled or baked buckwheat
kashmir,noun,an area in southwestern Asia whose sovereignty is disputed between Pakistan and India
kashmiri,noun,a member of the people of Kashmir
kashmiri,noun,the official state language of Kashmir
kashmiri,adjective,of or relating to or characteristic of Kashmir or its people or culture
kashmirs,noun,an area in southwestern Asia whose sovereignty is disputed between Pakistan and India
kassite,noun,a member of an ancient people who ruled Babylonia between 1600 and 1200 BC
kassite,noun,an ancient language spoken by the Kassites
kat,noun,the leaves of the shrub Catha edulis which are chewed like tobacco or used to make tea; has the effect of a euphoric stimulant
katabatic,adjective,of an air current or wind; moving downward or down a slope because of cooling especially at night
katabolic,adjective,relating to or characterized by catabolism
katabolic,adjective,characterized by destructive metabolism
katabolism,noun,breakdown in living organisms of more complex substances into simpler ones together with release of energy
katamorphism,noun,metamorphism that occurs at or near the earth's surface; breaks down complex minerals into simpler ones
katar,noun,an Arab country on the peninsula of Qatar; achieved independence from the United Kingdom in 1971; the economy is dominated by oil
katar,noun,a peninsula extending northward from the Arabian mainland into the Persian Gulf
katharevusa,noun,literary style of Modern Greek containing features borrowed from Koine
katharometer,noun,measures thermal conductivity
katharsis,noun,purging the body by the use of a cathartic to stimulate evacuation of the bowels
katharsis,noun,(psychoanalysis) purging of emotional tensions
katydid,noun,large green long-horned grasshopper of North America; males produce shrill sounds by rubbing together special organs on the forewings
katydids,noun,large green long-horned grasshopper of North America; males produce shrill sounds by rubbing together special organs on the forewings
kats,noun,the leaves of the shrub Catha edulis which are chewed like tobacco or used to make tea; has the effect of a euphoric stimulant
katsuwonidae,noun,in some classifications considered a separate family comprising the oceanic bonitos
katzenjammer,noun,disagreeable aftereffects from the use of drugs (especially alcohol)
katzenjammer,noun,loud confused noise from many sources
kauri,noun,resin of the kauri trees of New Zealand; found usually as a fossil; also collected for making varnishes and linoleum
kauri,noun,tall timber tree of New Zealand having white straight-grained wood
kauri,noun,white close-grained wood of a tree of the genus Agathis especially Agathis australis
kaury,noun,tall timber tree of New Zealand having white straight-grained wood
kauries,noun,tall timber tree of New Zealand having white straight-grained wood
kauris,noun,resin of the kauri trees of New Zealand; found usually as a fossil; also collected for making varnishes and linoleum
kauris,noun,tall timber tree of New Zealand having white straight-grained wood
kauris,noun,white close-grained wood of a tree of the genus Agathis especially Agathis australis
kava,noun,an alcoholic drink made from the aromatic roots of the kava shrub
kavas,noun,an alcoholic drink made from the aromatic roots of the kava shrub
kavass,noun,an alcoholic drink made from the aromatic roots of the kava shrub
kavasses,noun,an alcoholic drink made from the aromatic roots of the kava shrub
kawaka,noun,New Zealand timber tree resembling the cypress
kazak,noun,a Muslim who is a member of a Turkic people of western Asia (especially in Kazakstan)
kazak,noun,a landlocked republic to the south of Russia and to the northeast of the Caspian Sea; the original Turkic-speaking inhabitants were overrun by Mongols in the 13th century; an Asian soviet from 1936 to 1991
kazak,noun,the Turkic language spoken by the Kazak
kazoo,noun,a toy wind instrument that has a membrane that makes a sound when you hum into the mouthpiece
kazoos,noun,a toy wind instrument that has a membrane that makes a sound when you hum into the mouthpiece
kb,noun,a unit of information equal to 1000 bits
kb,noun,a unit of information equal to 1000 bytes
kb,noun,a unit of information equal to 1024 bytes
kc,noun,one thousand periods per second
kea,noun,large brownish-green New Zealand parrot
keas,noun,large brownish-green New Zealand parrot
keats,noun,Englishman and romantic poet (1795-1821)
keb,noun,Egyptian god of the earth; father of Osiris and Isis
kebab,noun,cubes of meat marinated and cooked on a skewer usually with vegetables
kebabs,noun,cubes of meat marinated and cooked on a skewer usually with vegetables
kedgeree,noun,a dish of rice and hard-boiled eggs and cooked flaked fish
kedgerees,noun,a dish of rice and hard-boiled eggs and cooked flaked fish
keel,noun,a projection or ridge that suggests a keel
keel,noun,the median ridge on the breastbone of birds that fly
keel,noun,one of the main longitudinal beams (or plates) of the hull of a vessel; can extend vertically into the water to provide lateral stability
keel,verb,walk as if unable to control one's movements
keelboat,noun,river boat with a shallow draught and a keel but no sails; used to carry freight; moved by rowing or punting or towing
keelboats,noun,river boat with a shallow draught and a keel but no sails; used to carry freight; moved by rowing or punting or towing
keeled,verb,walk as if unable to control one's movements
keeled,adjective,having a ridge or shaped like a ridge or suggesting the keel of a ship
keeling,verb,walk as if unable to control one's movements
keels,noun,a projection or ridge that suggests a keel
keels,noun,the median ridge on the breastbone of birds that fly
keels,noun,one of the main longitudinal beams (or plates) of the hull of a vessel; can extend vertically into the water to provide lateral stability
keels,verb,walk as if unable to control one's movements
keelson,noun,a longitudinal beam connected to the keel of ship to strengthen it
keelsons,noun,a longitudinal beam connected to the keel of ship to strengthen it
keen,noun,a funeral lament sung with loud wailing
keen,verb,express grief verbally
keen,s,having or demonstrating ability to recognize or draw fine distinctions
keen,s,intense or sharp
keen,s,very good
keen,s,painful as if caused by a sharp instrument
keen,s,having a sharp cutting edge or point
keened,verb,express grief verbally
keener,s,having or demonstrating ability to recognize or draw fine distinctions
keener,s,intense or sharp
keener,s,very good
keener,s,painful as if caused by a sharp instrument
keener,s,having a sharp cutting edge or point
keenest,s,having or demonstrating ability to recognize or draw fine distinctions
keenest,s,intense or sharp
keenest,s,very good
keenest,s,painful as if caused by a sharp instrument
keenest,s,having a sharp cutting edge or point
keening,verb,express grief verbally
keenly,adverb,in a keen and discriminating manner
keenness,noun,a quick and penetrating intelligence
keenness,noun,a positive feeling of wanting to push ahead with something
keenness,noun,thinness of edge or fineness of point
keennesses,noun,a quick and penetrating intelligence
keennesses,noun,a positive feeling of wanting to push ahead with something
keennesses,noun,thinness of edge or fineness of point
keens,noun,a funeral lament sung with loud wailing
keens,verb,express grief verbally
keep,noun,the financial means whereby one lives
keep,noun,the main tower within the walls of a medieval castle or fortress
keep,noun,a cell in a jail or prison
keep,verb,"keep in a certain state, position, or activity; e.g., ""keep clean"""
keep,verb,"continue a certain state, condition, or activity"
keep,verb,retain possession of
keep,verb,stop (someone or something) from doing something or being in a certain state
keep,verb,conform one's action or practice to
keep,verb,stick to correctly or closely
keep,verb,look after; be the keeper of; have charge of
keep,verb,maintain by writing regular records
keep,verb,supply with room and board
keep,verb,allow to remain in a place or position or maintain a property or feature
keep,verb,supply with necessities and support
keep,verb,fail to spoil or rot
keep,verb,behave as expected during of holidays or rites
keep,verb,keep under control; keep in check
keep,verb,"maintain in safety from injury, harm, or danger"
keep,verb,raise
keep,verb,retain rights to
keep,verb,store or keep customarily
keep,verb,have as a supply
keep,verb,maintain for use and service
keep,verb,hold and prevent from leaving
keep,verb,prevent (food) from rotting
keeper,noun,someone in charge of other people
keeper,noun,one having charge of buildings or grounds or animals
keepers,noun,someone in charge of other people
keepers,noun,one having charge of buildings or grounds or animals
keeping,noun,conformity or harmony
