Head,verb,"To go or point in a certain direction; to tend; as, how does the ship head?"""
Head,verb,"To form a head; as, this kind of cabbage heads early."""
Headache,noun,Pain in the head; cephalalgia.
Headachy,adjective,Afflicted with headache.
Headband,noun,A fillet; a band for the head.
Headband,noun,The band at each end of the back of a book.
Headbeard,noun,"A board or boarding which marks or forms the head of anything; as, the headboard of a bed; the headboard of a grave."""
Headborough,noun,Alt. of Headborrow
Headborrow,noun,"The chief of a frankpledge, tithing, or decennary, consisting of ten families; -- called also borsholder, boroughhead, boroughholder, and sometimes tithingman. See Borsholder."""
Headborrow,noun,A petty constable.
Head-cheese,noun,"A dish made of portions of the head, or head and feet, of swine, cut up fine, seasoned, and pressed into a cheeselike mass."""
Headdress,noun,A covering or ornament for the head; a headtire.
Headdress,noun,"A manner of dressing the hair or of adorning it, whether with or without a veil, ribbons, combs, etc."""
Headed,adjective,"Furnished with a head (commonly as denoting intellectual faculties); -- used in composition; as, clear-headed, long-headed, thick-headed; a many-headed monster."""
Headed,adjective,"Formed into a head; as, a headed cabbage."""
Header,noun,"One who, or that which, heads nails, rivets, etc., esp. a machine for heading."""
Header,noun,"One who heads a movement, a party, or a mob; head; chief; leader."""
Header,noun,A brick or stone laid with its shorter face or head in the surface of the wall.
Header,noun,"In framing, the piece of timber fitted between two trimmers, and supported by them, and carrying the ends of the tailpieces."""
Header,noun,"A reaper for wheat, that cuts off the heads only."""
Header,noun,"A fall or plunge headforemost, as while riding a bicycle, or in bathing; as, to take a header."""
Headfirst,verb,Alt. of Headforemost
Headforemost,verb,With the head foremost.
Headfish,noun,The sunfish (Mola).
Head gear,noun,Alt. of Headgear
Headgear,noun,Headdress.
Headgear,noun,Apparatus above ground at the mouth of a mine or deep well.
Head-hunter,noun,A member of any tribe or race of savages who have the custom of decapitating human beings and preserving their heads as trophies. The Dyaks of Borneo are the most noted head-hunters.
Headily,verb,In a heady or rash manner; hastily; rashly; obstinately.
Headiness,noun,The quality of being heady.
Heading,noun,"The act or state of one who, or that which, heads; formation of a head."""
Heading,noun,"That which stands at the head; title; as, the heading of a paper."""
Heading,noun,"Material for the heads of casks, barrels, etc."""
Heading,noun,"A gallery, drift, or adit in a mine; also, the end of a drift or gallery; the vein above a drift."""
Heading,noun,The extension of a line ruffling above the line of stitch.
Heading,noun,That end of a stone or brick which is presented outward.
Headland,noun,A cape; a promontory; a point of land projecting into the sea or other expanse of water.
Headland,noun,"A ridge or strip of unplowed at the ends of furrows, or near a fence."""
Headless,adjective,"Having no head; beheaded; as, a headless body, neck, or carcass."""
Headless,adjective,Destitute of a chief or leader.
Headless,adjective,Destitute of understanding or prudence; foolish; rash; obstinate.
Headlight,noun,"A light, with a powerful reflector, placed at the head of a locomotive, or in front of it, to throw light on the track at night, or in going through a dark tunnel."""
Headline,noun,The line at the head or top of a page.
Headline,noun,See Headrope.
Headlong,adjective,"With the head foremost; as, to fall headlong."""
Headlong,adjective,Rashly; precipitately; without deliberation.
Headlong,adjective,Hastily; without delay or respite.
Headlong,adjective,"Rash; precipitate; as, headlong folly."""
Headlong,adjective,Steep; precipitous.
Head-lugged,adjective,Lugged or dragged by the head.
Headmen,unknown,of Headman
Headman,noun,"A head or leading man, especially of a village community."""
Headmold shot,unknown,Alt. of Headmould shot
Headmould shot,unknown,"An old name for the condition of the skull, in which the bones ride, or are shot, over each other at the sutures."""
Headmost,adjective,"Most advanced; most forward; as, the headmost ship in a fleet."""
Headnote,noun,"A note at the head of a page or chapter; in law reports, an abstract of a case, showing the principles involved and the opinion of the court."""
Headpan,noun,The brainpan.
Headpiece,noun,Head.
Headpiece,noun,"A cap of defense; especially, an open one, as distinguished from the closed helmet of the Middle Ages."""
Headpiece,noun,Understanding; mental faculty.
Headpiece,noun,"An engraved ornament at the head of a chapter, or of a page."""
Headquarters,noun,"The quarters or place of residence of any chief officer, as the general in command of an army, or the head of a police force; the place from which orders or instructions are issued; hence, the center of authority or order."""
Headrace,noun,"See Race, a water course."""
Headroom,noun,"See Headway, 2."""
Headrope,noun,That part of a boltrope which is sewed to the upper edge or head of a sail.
Headsail,noun,Any sail set forward of the foremast.
Headshake,noun,"A significant shake of the head, commonly as a signal of denial."""
Headship,noun,Authority or dignity; chief place.
Headsmen,unknown,of Headsman
Headsman,noun,An executioner who cuts off heads.
Headspring,noun,Fountain; source.
Headstall,noun,That part of a bridle or halter which encompasses the head.
Headstock,noun,A part (usually separate from the bed or frame) for supporting some of the principal working parts of a machine
Headstock,noun,"The part of a lathe that holds the revolving spindle and its attachments; -- also called poppet head, the opposite corresponding part being called a tailstock."""
Headstock,noun,"The part of a planing machine that supports the cutter, etc."""
Headstone,noun,The principal stone in a foundation; the chief or corner stone.
Headstone,noun,The stone at the head of a grave.
Headstrong,adjective,Not easily restrained; ungovernable; obstinate; stubborn.
Headstrong,adjective,"Directed by ungovernable will, or proceeding from obstinacy."""
Headstrongness,noun,Obstinacy.
Headtire,noun,A headdress.
Headtire,noun,"The manner of dressing the head, as at a particular time and place."""
Headway,noun,"The progress made by a ship in motion; hence, progress or success of any kind."""
Headway,noun,"Clear space under an arch, girder, and the like, sufficient to allow of easy passing underneath."""
Headwork,noun,Mental labor.
Heady,adjective,Willful; rash; precipitate; hurried on by will or passion; ungovernable.
Heady,adjective,Apt to affect the head; intoxicating; strong.
Heady,adjective,Violent; impetuous.
Heal,verb,"To cover, as a roof, with tiles, slate, lead, or the like."""
Healed,unknown,of Heal
Healing,noun,of Heal
Heal,verb,"To make hale, sound, or whole; to cure of a disease, wound, or other derangement; to restore to soundness or health."""
Heal,verb,To remove or subdue; to cause to pass away; to cure; -- said of a disease or a wound.
Heal,verb,To restore to original purity or integrity.
Heal,verb,"To reconcile, as a breach or difference; to make whole; to free from guilt; as, to heal dissensions."""
Heal,verb,"To grow sound; to return to a sound state; as, the limb heals, or the wound heals; -- sometimes with up or over; as, it will heal up, or over."""
Heal,verb,Health.
Healable,adjective,Capable of being healed.
Healall,noun,"A common herb of the Mint family (Brunela vulgaris), destitute of active properties, but anciently thought a panacea."""
Heald,noun,A heddle.
Healful,adjective,Tending or serving to heal; healing.
Healing,adjective,"Tending to cure; soothing; mollifying; as, the healing art; a healing salve; healing words."""
Healingly,verb,So as to heal or cure.
Health,noun,"The state of being hale, sound, or whole, in body, mind, or soul; especially, the state of being free from physical disease or pain."""
Health,noun,"A wish of health and happiness, as in pledging a person in a toast."""
Healthful,adjective,"Full of health; free from illness or disease; well; whole; sound; healthy; as, a healthful body or mind; a healthful plant."""
Healthful,adjective,"Serving to promote health of body or mind; wholesome; salubrious; salutary; as, a healthful air, diet."""
Healthful,adjective,"Indicating, characterized by, or resulting from, health or soundness; as, a healthful condition."""
Healthful,adjective,Well-disposed; favorable.
Healthfully,verb,In health; wholesomely.
Healthfulness,noun,The state of being healthful.
Healthily,verb,In a healthy manner.
Healthiness,noun,The state of being healthy or healthful; freedom from disease.
Healthless,noun,"Without health, whether of body or mind; in firm."""
Healthless,noun,Not conducive to health; unwholesome.
Healthlessness,noun,The state of being health/ess.
Healthsome,adjective,Wholesome; salubrious.
Healthward,adjective,"In the direction of health; as, a healthward tendency."""
Healthy,unknown,"Being in a state of health; enjoying health; hale; sound; free from disease; as, a healthy chid; a healthy plant."""
Healthy,unknown,"Evincing health; as, a healthy pulse; a healthy complexion."""
Healthy,unknown,"Conducive to health; wholesome; salubrious; salutary; as, a healthy exercise; a healthy climate."""
Heam,noun,The afterbirth or secundines of a beast.
Heap,noun,A crowd; a throng; a multitude or great number of persons.
Heap,noun,A great number or large quantity of things not placed in a pile.
Heap,noun,"A pile or mass; a collection of things laid in a body, or thrown together so as to form an elevation; as, a heap of earth or stones."""
Heaped,unknown,of Heap
Heaping,noun,of Heap
Heap,verb,"To collect in great quantity; to amass; to lay up; to accumulate; -- usually with up; as, to heap up treasures."""
Heap,verb,"To throw or lay in a heap; to make a heap of; to pile; as, to heap stones; -- often with up; as, to heap up earth; or with on; as, to heap on wood or coal."""
Heap,verb,"To form or round into a heap, as in measuring; to fill (a measure) more than even full."""
Heaper,noun,"One who heaps, piles, or amasses."""
Heapy,adjective,Lying in heaps.
Heard,unknown,of Hear
Hearing,noun,of Hear
Hear,verb,"To perceive by the ear; to apprehend or take cognizance of by the ear; as, to hear sounds; to hear a voice; to hear one call."""
Hear,verb,"To give audience or attention to; to listen to; to heed; to accept the doctrines or advice of; to obey; to examine; to try in a judicial court; as, to hear a recitation; to hear a class; the case will be heard to-morrow."""
Hear,verb,"To attend, or be present at, as hearer or worshiper; as, to hear a concert; to hear Mass."""
Hear,verb,To give attention to as a teacher or judge.
Hear,verb,To accede to the demand or wishes of; to listen to and answer favorably; to favor.
Hear,verb,To have the sense or faculty of perceiving sound.
Hear,verb,To use the power of perceiving sound; to perceive or apprehend by the ear; to attend; to listen.
Hear,verb,To be informed by oral communication; to be told; to receive information by report or by letter.
Heard,unknown,imp. & p. p. of Hear.
Hearer,noun,One who hears; an auditor.
Hearing,noun,"The act or power of perceiving sound; perception of sound; the faculty or sense by which sound is perceived; as, my hearing is good."""
Hearing,noun,"Attention to what is delivered; opportunity to be heard; audience; as, I could not obtain a hearing."""
Hearing,noun,"A listening to facts and evidence, for the sake of adjudication; a session of a court for considering proofs and determining issues."""
Hearing,noun,Extent within which sound may be heard; sound; earshot.
Hearkened,unknown,of Hearken
Hearkening,noun,of Hearken
Hearken,verb,"To listen; to lend the ear; to attend to what is uttered; to give heed; to hear, in order to obey or comply."""
Hearken,verb,To inquire; to seek information.
Hearken,verb,To hear by listening.
Hearken,verb,To give heed to; to hear attentively.
Hearkener,noun,One who hearkens; a listener.
Hearsal,noun,Rehearsal.
Hearsay,noun,Report; rumor; fame; common talk; something heard from another.
Hearse,noun,A hind in the year of its age.
Hearse,noun,"A framework of wood or metal placed over the coffin or tomb of a deceased person, and covered with a pall; also, a temporary canopy bearing wax lights and set up in a church, under which the coffin was placed during the funeral ceremonies."""
Hearse,noun,"A grave, coffin, tomb, or sepulchral monument."""
Hearse,noun,A bier or handbarrow for conveying the dead to the grave.
Hearse,noun,A carriage specially adapted or used for conveying the dead to the grave.
Hearse,verb,To inclose in a hearse; to entomb.
Hearsecloth,noun,A cloth for covering a coffin when on a bier; a pall.
Hearselike,adjective,Suitable to a funeral.
Heart,noun,"A hollow, muscular organ, which, by contracting rhythmically, keeps up the circulation of the blood."""
Heart,noun,"The seat of the affections or sensibilities, collectively or separately, as love, hate, joy, grief, courage, and the like; rarely, the seat of the understanding or will; -- usually in a good sense, when no epithet is expressed; the better or lovelier part of our nature; the spring of all our actions and purposes; the seat of moral life and character; the moral affections and character itself; the individual disposition and character; as, a good, tender, loving, bad, hard, or selfish heart."""
Heart,noun,"The nearest the middle or center; the part most hidden and within; the inmost or most essential part of any body or system; the source of life and motion in any organization; the chief or vital portion; the center of activity, or of energetic or efficient action; as, the heart of a country, of a tree, etc."""
Heart,noun,Courage; courageous purpose; spirit.
Heart,noun,"Vigorous and efficient activity; power of fertile production; condition of the soil, whether good or bad."""
Heart,noun,"That which resembles a heart in shape; especially, a roundish or oval figure or object having an obtuse point at one end, and at the other a corresponding indentation, -- used as a symbol or representative of the heart."""
Heart,noun,"One of a series of playing cards, distinguished by the figure or figures of a heart; as, hearts are trumps."""
Heart,noun,Vital part; secret meaning; real intention.
Heart,noun,A term of affectionate or kindly and familiar address.
Heart,verb,To give heart to; to hearten; to encourage; to inspirit.
Heart,verb,"To form a compact center or heart; as, a hearting cabbage."""
Heartache,noun,Sorrow; anguish of mind; mental pang.
Heartbreak,noun,Crushing sorrow or grief; a yielding to such grief.
Heartbreaking,adjective,Causing overpowering sorrow.
Heartbroken,adjective,Overcome by crushing sorrow; deeply grieved.
Heartburn,noun,"An uneasy, burning sensation in the stomach, often attended with an inclination to vomit. It is sometimes idiopathic, but is often a symptom of often complaints."""
Heartburned,adjective,Having heartburn.
Heartburning,adjective,Causing discontent.
Heartburning,noun,Same as Heartburn.
Heartburning,noun,Discontent; secret enmity.
Heartdear,adjective,Sincerely beloved.
Heartdeep,adjective,Rooted in the heart.
Heart-eating,adjective,Preying on the heart.
Hearted,adjective,"Having a heart; having (such) a heart (regarded as the seat of the affections, disposition, or character)."""
Hearted,adjective,Shaped like a heart; cordate.
Hearted,adjective,Seated or laid up in the heart.
Heartedness,noun,Earnestness; sincerity; heartiness.
Hearten,verb,To encourage; to animate; to incite or stimulate the courage of; to embolden.
Hearten,verb,"To restore fertility or strength to, as to land."""
Heartener,noun,"One who, or that which, heartens, animates, or stirs up."""
Heartfelt,adjective,Hearty; sincere.
Heartgrief,noun,Heartache; sorrow.
Hearth,noun,"The pavement or floor of brick, stone, or metal in a chimney, on which a fire is made; the floor of a fireplace; also, a corresponding part of a stove."""
Hearth,noun,"The house itself, as the abode of comfort to its inmates and of hospitality to strangers; fireside."""
Hearth,noun,"The floor of a furnace, on which the material to be heated lies, or the lowest part of a melting furnace, into which the melted material settles."""
Hearthstone,noun,"Stone forming the hearth; hence, the fireside; home."""
Heartily,verb,From the heart; with all the heart; with sincerity.
Heartily,verb,"With zeal; actively; vigorously; willingly; cordially; as, he heartily assisted the prince."""
Heariness,noun,"The quality of being hearty; as, the heartiness of a greeting."""
Heartless,adjective,Without a heart.
Heartless,adjective,Destitute of courage; spiritless; despodent.
Heartless,adjective,Destitute of feeling or affection; unsympathetic; cruel.
Heartlet,noun,A little heart.
Heartlings,unknown,An exclamation used in addressing a familiar acquaintance.
Heartpea,noun,Same as Heartseed.
Heartquake,noun,Trembling of the heart; trepidation; fear.
Heartrending,adjective,Causing intense grief; overpowering with anguish; very distressing.
Heart-robbing,adjective,Depriving of thought; ecstatic.
Heart-robbing,adjective,Stealing the heart or affections; winning.
Heart's-ease,noun,Ease of heart; peace or tranquillity of mind or feeling.
Heart's-ease,noun,A species of violet (Viola tricolor); -- called also pansy.
Heartseed,noun,"A climbing plant of the genus Cardiospermum, having round seeds which are marked with a spot like a heart."""
Heartshaped,adjective,Having the shape of a heart; cordate.
Heartsick,adjective,Sick at heart; extremely depressed in spirits; very despondent.
Heartsome,adjective,Merry; cheerful; lively.
Heart-spoon,noun,A part of the breastbone.
Heartstricken,adjective,Shocked; dismayed.
Heartstrike,verb,To affect at heart; to shock.
Heartstring,noun,"A nerve or tendon, supposed to brace and sustain the heart."""
Heartstruck,adjective,Driven to the heart; infixed in the mind.
Heartstruck,adjective,"Shocked with pain, fear, or remorse; dismayed; heartstricken."""
Heartswelling,adjective,"Rankling in, or swelling, the heart."""
Heart-whole,adjective,Having the heart or affections free; not in love.
Heart-whole,adjective,With unbroken courage; undismayed.
Heart-whole,adjective,Of a single and sincere heart.
Heartwood,noun,"The hard, central part of the trunk of a tree, consisting of the old and matured wood, and usually differing in color from the outer layers. It is technically known as duramen, and distinguished from the softer sapwood or alburnum."""
Heart-wounded,adjective,Wounded to the heart with love or grief.
Hearty,unknown,"Pertaining to, or proceeding from, the heart; warm; cordial; bold; zealous; sincere; willing; also, energetic; active; eager; as, a hearty welcome; hearty in supporting the government."""
Hearty,unknown,"Exhibiting strength; sound; healthy; firm; not weak; as, a hearty timber."""
Hearty,unknown,"Promoting strength; nourishing; rich; abundant; as, hearty food; a hearty meal."""
Hearties,unknown,of Hearty
Hearty,noun,Comrade; boon companion; good fellow; -- a term of familiar address and fellowship among sailors.
Heartyhale,adjective,Good for the heart.
Heat,noun,"A force in nature which is recognized in various effects, but especially in the phenomena of fusion and evaporation, and which, as manifested in fire, the sun's rays, mechanical action, chemical combination, etc., becomes directly known to us through the sense of feeling. In its nature heat is a mode if motion, being in general a form of molecular disturbance or vibration. It was formerly supposed to be a subtile, imponderable fluid, to which was given the name caloric."""
Heat,noun,"The sensation caused by the force or influence of heat when excessive, or above that which is normal to the human body; the bodily feeling experienced on exposure to fire, the sun's rays, etc.; the reverse of cold."""
Heat,noun,"High temperature, as distinguished from low temperature, or cold; as, the heat of summer and the cold of winter; heat of the skin or body in fever, etc."""
Heat,noun,"Indication of high temperature; appearance, condition, or color of a body, as indicating its temperature; redness; high color; flush; degree of temperature to which something is heated, as indicated by appearance, condition, or otherwise."""
Heat,noun,"A single complete operation of heating, as at a forge or in a furnace; as, to make a horseshoe in a certain number of heats."""
Heat,noun,"A violent action unintermitted; a single effort; a single course in a race that consists of two or more courses; as, he won two heats out of three."""
Heat,noun,"Utmost violence; rage; vehemence; as, the heat of battle or party."""
Heat,noun,Agitation of mind; inflammation or excitement; exasperation.
Heat,noun,"Animation, as in discourse; ardor; fervency."""
Heat,noun,Sexual excitement in animals.
Heat,noun,Fermentation.
Heated,unknown,of Heat
Heating,noun,of Heat
Heat,verb,"To make hot; to communicate heat to, or cause to grow warm; as, to heat an oven or furnace, an iron, or the like."""
Heat,verb,To excite or make hot by action or emotion; to make feverish.
Heat,verb,"To excite ardor in; to rouse to action; to excite to excess; to inflame, as the passions."""
Heat,verb,"To grow warm or hot by the action of fire or friction, etc., or the communication of heat; as, the iron or the water heats slowly."""
Heat,verb,"To grow warm or hot by fermentation, or the development of heat by chemical action; as, green hay heats in a mow, and manure in the dunghill."""
Heat,unknown,"Heated; as, the iron though heat red-hot."""
Heater,noun,"One who, or that which, heats."""
Heater,noun,"Any contrivance or implement, as a furnace, stove, or other heated body or vessel, etc., used to impart heat to something, or to contain something to be heated."""
Heath,noun,"A low shrub (Erica, / Calluna, vulgaris), with minute evergreen leaves, and handsome clusters of pink flowers. It is used in Great Britain for brooms, thatch, beds for the poor, and for heating ovens. It is also called heather, and ling."""
Heath,noun,"Also, any species of the genus Erica, of which several are European, and many more are South African, some of great beauty. See Illust. of Heather."""
Heath,noun,A place overgrown with heath; any cheerless tract of country overgrown with shrubs or coarse herbage.
Heathclad,adjective,Clad or crowned with heath.
Heathens,unknown,of Heathen
Heathen,unknown,of Heathen
Heathen,noun,"An individual of the pagan or unbelieving nations, or those which worship idols and do not acknowledge the true God; a pagan; an idolater."""
Heathen,noun,An irreligious person.
Heathen,adjective,"Gentile; pagan; as, a heathen author."""
Heathen,adjective,Barbarous; unenlightened; heathenish.
Heathen,adjective,Irreligious; scoffing.
Heathendom,noun,"That part of the world where heathenism prevails; the heathen nations, considered collectively."""
Heathendom,noun,Heathenism.
Heathenesse,noun,Heathendom.
Heathenish,adjective,Of or pertaining to the heathen; resembling or characteristic of heathens.
Heathenish,adjective,Rude; uncivilized; savage; cruel.
Heathenish,adjective,"Irreligious; as, a heathenish way of living."""
Heathenishly,verb,In a heathenish manner.
Heathenishness,noun,The state or quality of being heathenish.
Heathenism,noun,The religious system or rites of a heathen nation; idolatry; paganism.
Heathenism,noun,The manners or morals usually prevalent in a heathen country; ignorance; rudeness; barbarism.
Heathenized,unknown,of Heathenize
Heathenizing,noun,of Heathenize
Heathenize,verb,To render heathen or heathenish.
Heathenness,noun,State of being heathen or like the heathen.
Heathenry,noun,"The state, quality, or character of the heathen."""
Heathenry,noun,Heathendom; heathen nations.
Heather,noun,Heath.
Heathery,adjective,Heathy; abounding in heather; of the nature of heath.
Heathy,adjective,"Full of heath; abounding with heath; as, heathy land; heathy hills."""
Heating,adjective,"That heats or imparts heat; promoting warmth or heat; exciting action; stimulating; as, heating medicines or applications."""
Heatingly,verb,In a heating manner; so as to make or become hot or heated.
Heatless,adjective,Destitute of heat; cold.
Heaved,unknown,of Heave
Hove,unknown,of Heave
Heaved,unknown,of Heave
Hove,unknown,of Heave
Hoven,unknown,of Heave
Heaving,noun,of Heave
Heave,verb,"To cause to move upward or onward by a lifting effort; to lift; to raise; to hoist; -- often with up; as, the wave heaved the boat on land."""
Heave,verb,"To throw; to cast; -- obsolete, provincial, or colloquial, except in certain nautical phrases; as, to heave the lead; to heave the log."""
Heave,verb,"To force from, or into, any position; to cause to move; also, to throw off; -- mostly used in certain nautical phrases; as, to heave the ship ahead."""
Heave,verb,"To raise or force from the breast; to utter with effort; as, to heave a sigh."""
Heave,verb,"To cause to swell or rise, as the breast or bosom."""
Heave,verb,"To be thrown up or raised; to rise upward, as a tower or mound."""
Heave,verb,"To rise and fall with alternate motions, as the lungs in heavy breathing, as waves in a heavy sea, as ships on the billows, as the earth when broken up by frost, etc.; to swell; to dilate; to expand; to distend; hence, to labor; to struggle."""
Heave,verb,"To make an effort to raise, throw, or move anything; to strain to do something difficult."""
Heave,verb,To make an effort to vomit; to retch; to vomit.
