Hexameter,noun,"A verse of six feet, the first four of which may be either dactyls or spondees, the fifth must regularly be a dactyl, and the sixth always a spondee. In this species of verse are composed the Iliad of Homer and the Aeneid of Virgil. In English hexameters accent takes the place of quantity."""
Hexameter,adjective,"Having six metrical feet, especially dactyls and spondees."""
Hexametric,adjective,Alt. of Hexametrical
Hexametrical,adjective,Consisting of six metrical feet.
Hexametrist,noun,One who writes in hexameters.
Hexandria,noun,A Linnaean class of plants having six stamens.
Hexandrian,adjective,Alt. of Hex-androus
Hex-androus,adjective,Having six stamens.
Hexane,noun,"Any one of five hydrocarbons, C6H14, of the paraffin series. They are colorless, volatile liquids, and are so called because the molecule has six carbon atoms."""
Hexangular,adjective,Having six angles or corners.
Hexapetalous,adjective,Having six petals.
Hexaphyllous,adjective,Having six leaves or leaflets.
Hexapla,unknown,"A collection of the Holy Scriptures in six languages or six versions in parallel columns; particularly, the edition of the Old Testament published by Origen, in the 3d century."""
Hexapod,adjective,Having six feet.
Hexapod,noun,An animal having six feet; one of the Hexapoda.
Hexapoda,noun,"The true, or six-legged, insects; insects other than myriapods and arachnids."""
Hexapodous,adjective,Having six feet; belonging to the Hexapoda.
Hexapterous,adjective,Having six processes.
Hexastich,noun,Alt. of Hexastichon
Hexastichon,noun,A poem consisting of six verses or lines.
Hexastyle,adjective,Having six columns in front; -- said of a portico or temple.
Hexastyle,noun,A hexastyle portico or temple.
Hexateuch,noun,The first six books of the Old Testament.
Hexatomic,adjective,Having six atoms in the molecule.
Hexatomic,adjective,Having six replaceable radicals.
Hexavalent,unknown,Having a valence of six; -- said of hexads.
Hexdecyl,noun,"The essential radical, C16H33, of hecdecane."""
Hexdecylic,adjective,"Pertaining to, or derived from, hexdecyl or hecdecane; as, hexdecylic alcohol."""
Hexeikosane,noun,"A hydrocarbon, C26H54, resembling paraffine; -- so called because each molecule has twenty-six atoms of carbon."""
Hexene,noun,Same as Hexylene.
Hexicology,noun,"The science which treats of the complex relations of living creatures to other organisms, and to their surrounding conditions generally."""
Hexine,noun,"A hydrocarbon, C6H10, of the acetylene series, obtained artificially as a colorless, volatile, pungent liquid; -- called also hexoylene."""
Hexoctahedron,noun,A solid having forty-eight equal triangular faces.
Hexoic,adjective,"Pertaining to, or derived from, hexane; as, hexoic acid."""
Hexone,noun,"A liquid hydrocarbon, C6H8, of the valylene series, obtained from distillation products of certain fats and gums."""
Hexyl,noun,"A compound radical, C6H13, regarded as the essential residue of hexane, and a related series of compounds."""
Hexylene,noun,"A colorless, liquid hydrocarbon, C6H12, of the ethylene series, produced artificially, and found as a natural product of distillation of certain coals; also, any one several isomers of hexylene proper. Called also hexene."""
Hexylic,adjective,"Pertaining to, or derived from, hexyl or hexane; as, hexylic alcohol."""
Hey,adjective,High.
Hey,unknown,"An exclamation of joy, surprise, or encouragement."""
Hey,unknown,A cry to set dogs on.
Heyday,unknown,"An expression of frolic and exultation, and sometimes of wonder."""
Heyday,noun,"The time of triumph and exultation; hence, joy, high spirits, frolicsomeness; wildness."""
Heydeguy,noun,A kind of country-dance or round.
Heyh,adjective,Alt. of Heygh
Heygh,adjective,High.
Heyne,noun,A wretch; a rascal.
Heyten,verb,Hence.
Hiation,noun,Act of gaping.
Hiatus,unknown,of Hiatus
Hiatuses,unknown,of Hiatus
Hiatus,noun,"An opening; an aperture; a gap; a chasm; esp., a defect in a manuscript, where some part is lost or effaced; a space where something is wanting; a break."""
Hiatus,noun,The concurrence of two vowels in two successive words or syllables.
Hibernacle,noun,"That which serves for protection or shelter in winter; winter quarters; as, the hibernacle of an animal or a plant."""
Hibernaculum,noun,"A winter bud, in which the rudimentary foliage or flower, as of most trees and shrubs in the temperate zone, is protected by closely overlapping scales."""
Hibernaculum,noun,A little case in which certain insects pass the winter.
Hibernaculum,noun,Winter home or abiding place.
Hibernal,adjective,Belonging or relating to winter; wintry; winterish.
Hibernated,unknown,of Hibernate
Hibernating,noun,of Hibernate
Hibernate,verb,"To winter; to pass the season of winter in close quarters, in a torpid or lethargic state, as certain mammals, reptiles, and insects."""
Hibernation,noun,The act or state of hibernating.
Hibernian,adjective,"Of or pertaining to Hibernia, now Ireland; Irish."""
Hibernian,noun,A native or an inhabitant of Ireland.
Hibernicism,noun,Alt. of Hibernianism
Hibernianism,noun,An idiom or mode of speech peculiar to the Irish.
Hiberno-Celtic,noun,The native language of the Irish; that branch of the Celtic languages spoken by the natives of Ireland. Also adj.
Hibiscus,noun,"A genus of plants (herbs, shrubs, or trees), some species of which have large, showy flowers. Some species are cultivated in India for their fiber, which is used as a substitute for hemp. See Althea, Hollyhock, and Manoe."""
Hiccius doctius,unknown,A juggler.
Hiccough,noun,"A modified respiratory movement; a spasmodic inspiration, consisting of a sudden contraction of the diaphragm, accompanied with closure of the glottis, so that further entrance of air is prevented, while the impulse of the column of air entering and striking upon the closed glottis produces a sound, or hiccough."""
Hiccoughed,unknown,of Hiccough
Hiccoughing,noun,of Hiccough
Hiccough,verb,To have a hiccough or hiccoughs.
Hickory,noun,"An American tree of the genus Carya, of which there are several species. The shagbark is the C. alba, and has a very rough bark; it affords the hickory nut of the markets. The pignut, or brown hickory, is the C. glabra. The swamp hickory is C. amara, having a nut whose shell is very thin and the kernel bitter."""
Hicksite,noun,"A member or follower of the """"liberal"""" party, headed by Elias Hicks, which, because of a change of views respecting the divinity of Christ and the Atonement, seceded from the conservative portion of the Society of Friends in the United States, in 1827."""
Hickup,noun,See Hiccough.
Hickwall,noun,Alt. of Hickway
Hickway,noun,The lesser spotted woodpecker (Dendrocopus minor) of Europe.
Hid,unknown,imp. & p. p. of Hide. See Hidden.
Hidage,noun,A tax formerly paid to the kings of England for every hide of land.
Hidalgo,noun,"A title, denoting a Spanish nobleman of the lower class."""
Hidden,adjective,from Hide. Concealed; put out of view; secret; not known; mysterious.
Hiddenite,noun,"An emerald-green variety of spodumene found in North Carolina; lithia emerald, -- used as a gem."""
Hiddenly,verb,In a hidden manner.
Hid,unknown,of Hide
Hidden,unknown,of Hide
Hid,unknown,of Hide
Hiding,noun,of Hide
Hide,verb,"To conceal, or withdraw from sight; to put out of view; to secrete."""
Hide,verb,To withhold from knowledge; to keep secret; to refrain from avowing or confessing.
Hide,verb,To remove from danger; to shelter.
Hide,verb,To lie concealed; to keep one's self out of view; to be withdrawn from sight or observation.
Hide,noun,An abode or dwelling.
Hide,noun,"A measure of land, common in Domesday Book and old English charters, the quantity of which is not well ascertained, but has been differently estimated at 80, 100, and 120 acres."""
Hide,noun,"The skin of an animal, either raw or dressed; -- generally applied to the undressed skins of the larger domestic animals, as oxen, horses, etc."""
Hide,noun,The human skin; -- so called in contempt.
Hided,unknown,of Hide
Hiding,noun,of Hide
Hide,verb,To flog; to whip.
Hidebound,adjective,Having the skin adhering so closely to the ribs and back as not to be easily loosened or raised; -- said of an animal.
Hidebound,adjective,Having the bark so close and constricting that it impedes the growth; -- said of trees.
Hidebound,adjective,Untractable; bigoted; obstinately and blindly or stupidly conservative.
Hidebound,adjective,Niggardly; penurious.
Hideous,adjective,"Frightful, shocking, or offensive to the eyes; dreadful to behold; as, a hideous monster; hideous looks."""
Hideous,adjective,"Distressing or offensive to the ear; exciting terror or dismay; as, a hideous noise."""
Hideous,adjective,Hateful; shocking.
Hider,noun,One who hides or conceals.
Hiding,noun,"The act of hiding or concealing, or of withholding from view or knowledge; concealment."""
Hiding,noun,A flogging.
Hied,unknown,of Hie
Hying,noun,of Hie
Hie,verb,To hasten; to go in haste; -- also often with the reciprocal pronoun.
Hie,noun,Haste; diligence.
Hiems,noun,Winter.
Hierapicra,noun,"A warming cathartic medicine, made of aloes and canella bark."""
Hierarch,noun,"One who has high and controlling authority in sacred things; the chief of a sacred order; as, princely hierarchs."""
Hierarchal,adjective,Alt. of Hierarchic
Hierarchic,adjective,Pertaining to a hierarch.
Hierarchical,adjective,Pertaining to a hierarchy.
Hierarchism,noun,The principles or authority of a hierarchy.
Hierarchies,unknown,of Hierarchy
Hierarchy,noun,Dominion or authority in sacred things.
Hierarchy,noun,A body of officials disposed organically in ranks and orders each subordinate to the one above it; a body of ecclesiastical rulers.
Hierarchy,noun,"A form of government administered in the church by patriarchs, metropolitans, archbishops, bishops, and, in an inferior degree, by priests."""
Hierarchy,noun,A rank or order of holy beings.
Hieratic,adjective,Consecrated to sacred uses; sacerdotal; pertaining to priests.
Hierocracy,noun,Government by ecclesiastics; a hierarchy.
Hieroglyph,adjective,Alt. of Hieroglyphic
Hieroglyphic,adjective,"A sacred character; a character in picture writing, as of the ancient Egyptians, Mexicans, etc. Specifically, in the plural, the picture writing of the ancient Egyptian priests. It is made up of three, or, as some say, four classes of characters: first, the hieroglyphic proper, or figurative, in which the representation of the object conveys the idea of the object itself; second, the ideographic, consisting of symbols representing ideas, not sounds, as an ostrich feather is a symbol of truth; third, the phonetic, consisting of symbols employed as syllables of a word, or as letters of the alphabet, having a certain sound, as a hawk represented the vowel a."""
Hieroglyphic,adjective,"Any character or figure which has, or is supposed to have, a hidden or mysterious significance; hence, any unintelligible or illegible character or mark."""
Hieroglyphic,adjective,Alt. of Hieroglyphical
Hieroglyphical,adjective,"Emblematic; expressive of some meaning by characters, pictures, or figures; as, hieroglyphic writing; a hieroglyphic obelisk."""
Hieroglyphical,adjective,Resembling hieroglyphics; not decipherable.
Hieroglyphically,verb,In hieroglyphics.
Hieroglyphist,noun,One versed in hieroglyphics.
Hierogram,noun,A form of sacred or hieratic writing.
Hierogrammatic,adjective,"Written in, or pertaining to, hierograms; expressive of sacred writing."""
Hierogrammatist,noun,"A writer of hierograms; also, one skilled in hieroglyphics."""
Hierographic,adjective,Alt. of Hierographical
Hierographical,adjective,Of or pertaining to sacred writing.
Hierography,noun,Sacred writing.
Hierolatry,noun,The worship of saints or sacred things.
Hierologic,adjective,Alt. of Hierological
Hierological,adjective,Pertaining to hierology.
Hierologist,noun,"One versed in, or whostudies, hierology."""
Hierology,noun,"A treatise on sacred things; especially, the science which treats of the ancient writings and inscriptions of the Egyptians, or a treatise on that science."""
Hieromancy,noun,Divination by observing the objects offered in sacrifice.
Hiermartyr,noun,A priest who becomes a martyr.
Hieromnemon,noun,"The sacred secretary or recorder sent by each state belonging to the Amphictyonic Council, along with the deputy or minister."""
Hieromnemon,noun,"A magistrate who had charge of religious matters, as at Byzantium."""
Hieron,noun,"A consecrated place; esp., a temple."""
Hieronymite,noun,See Jeronymite.
Hierophant,noun,"The presiding priest who initiated candidates at the Eleusinian mysteries; hence, one who teaches the mysteries and duties of religion."""
Hierophantic,adjective,Of or relating to hierophants or their teachings.
Hieroscopy,noun,Divination by inspection of entrails of victims offered in sacrifice.
-cae,unknown,of Hierotheca
Hierotheca,noun,A receptacle for sacred objects.
Hierourgy,noun,A sacred or holy work or worship.
Hifalutin,noun,See Highfaluting.
Higgled,unknown,of Higgle
Higgling,noun,of Higgle
Higgle,verb,To hawk or peddle provisions.
Higgle,verb,To chaffer; to stickle for small advantages in buying and selling; to haggle.
Higgledy-piggledy,verb,In confusion; topsy-turvy.
Higgler,noun,One who higgles.
High,verb,To hie.
High,unknown,"Elevated above any starting point of measurement, as a line, or surface; having altitude; lifted up; raised or extended in the direction of the zenith; lofty; tall; as, a high mountain, tower, tree; the sun is high."""
High,unknown,"Regarded as raised up or elevated; distinguished; remarkable; conspicuous; superior; -- used indefinitely or relatively, and often in figurative senses, which are understood from the connection"""
High,unknown,"Elevated in character or quality, whether moral or intellectual; preeminent; honorable; as, high aims, or motives."""
High,unknown,"Exalted in social standing or general estimation, or in rank, reputation, office, and the like; dignified; as, she was welcomed in the highest circles."""
High,unknown,"Of noble birth; illustrious; as, of high family."""
High,unknown,"Of great strength, force, importance, and the like; strong; mighty; powerful; violent; sometimes, triumphant; victorious; majestic, etc.; as, a high wind; high passions."""
High,unknown,Very abstract; difficult to comprehend or surmount; grand; noble.
High,unknown,"Costly; dear in price; extravagant; as, to hold goods at a high price."""
High,unknown,Arrogant; lofty; boastful; proud; ostentatious; -- used in a bad sense.
High,unknown,"Possessing a characteristic quality in a supreme or superior degree; as, high (i. e., intense) heat; high (i. e., full or quite) noon; high (i. e., rich or spicy) seasoning; high (i. e., complete) pleasure; high (i. e., deep or vivid) color; high (i. e., extensive, thorough) scholarship, etc."""
High,unknown,"Strong-scented; slightly tainted; as, epicures do not cook game before it is high."""
High,unknown,"Acute or sharp; -- opposed to grave or low; as, a high note."""
High,unknown,"Made with a high position of some part of the tongue in relation to the palate, as / (/ve), / (f/d). See Guide to Pronunciation, // 10, 11."""
High,verb,In a high manner; in a high place; to a great altitude; to a great degree; largely; in a superior manner; eminently; powerfully.
High,noun,An elevated place; a superior region; a height; the sky; heaven.
High,noun,"People of rank or high station; as, high and low."""
High,noun,The highest card dealt or drawn.
High,verb,"To rise; as, the sun higheth."""
Highbinder,noun,"A ruffian; one who hounds, or spies upon, another; app. esp. to the members of certain alleged societies among the Chinese."""
High-blown,adjective,"Inflated, as with conceit."""
Highborn,adjective,Of noble birth.
High-bred,adjective,Bred in high life; of pure blood.
High-built,adjective,Of lofty structure; tall.
High-church,adjective,"Of or pertaining to, or favoring, the party called the High Church, or their doctrines or policy. See High Church, under High, a."""
High-churchism,noun,The principles of the high-church party.
-men,unknown,of High-churchman
High-churchman,noun,One who holds high-church principles.
High-churchman-ship,noun,The state of being a high-churchman.
High-colored,adjective,"Having a strong, deep, or glaring color; flushed."""
High-colored,adjective,"Vivid; strong or forcible in representation; hence, exaggerated; as, high-colored description."""
High-embowed,adjective,Having lofty arches.
Highering,adjective,Rising higher; ascending.
Highfaluting,noun,"High-flown, bombastic language."""
High-fed,adjective,Pampered; fed luxuriously.
High-finished,adjective,Finished with great care; polished.
Highflier,noun,"One who is extravagant in pretensions, opinions, or manners."""
High-flown,adjective,Elevated; proud.
High-flown,adjective,"Turgid; extravagant; bombastic; inflated; as, high-flown language."""
High-flushed,adjective,Elated.
Highflying,adjective,Extravagant in opinions or ambition.
High-go,noun,A spree; a revel.
High-handed,adjective,"Overbearing; oppressive; arbitrary; violent; as, a high-handed act."""
High-hearted,adjective,Full of courage or nobleness; high-souled.
High-hoe,noun,The European green woodpecker or yaffle.
High-holder,noun,The flicker; -- called also high-hole.
Highland,noun,"Elevated or mountainous land; (often in the pl.) an elevated region or country; as, the Highlands of Scotland."""
Highlander,noun,"An inhabitant of highlands, especially of the Highlands of Scotland."""
Highlandry,noun,"Highlanders, collectively."""
High-low,noun,"A laced boot, ankle high."""
Highly,verb,"In a high manner, or to a high degree; very much; as, highly esteemed."""
Highmen,noun,Loaded dice so contrived as to turn up high numbers.
High-mettled,adjective,"Having abundance of mettle; ardent; full of fire; as, a high-mettled steed."""
High-minded,adjective,Proud; arrogant.
High-minded,adjective,"Having, or characterized by, honorable pride; of or pertaining to elevated principles and feelings; magnanimous; -- opposed to mean."""
High-mindedness,noun,The quality of being highminded; nobleness; magnanimity.
Highmost,adjective,Highest.
Highness,noun,The state of being high; elevation; loftiness.
Highness,noun,"A title of honor given to kings, princes, or other persons of rank; as, His Royal Highness."""
High-palmed,adjective,Having high antlers; bearing full-grown antlers aloft.
High-pressure,adjective,"Having or involving a pressure greatly exceeding that of the atmosphere; -- said of steam, air, water, etc., and of steam, air, or hydraulic engines, water wheels, etc."""
High-pressure,adjective,"Fig.: Urgent; intense; as, a high-pressure business or social life."""
High priest,unknown,"A chief priest; esp., the head of the Jewish priesthood."""
High-priesthood,noun,"The office, dignity, or position of a high priest."""
High-priestship,noun,High-priesthood.
High-principled,adjective,Possessed of noble or honorable principles.
High-proof,adjective,"Highly rectified; very strongly alcoholic; as, high-proof spirits."""
High-proof,adjective,So as to stand any test.
High-raised,adjective,Elevated; raised aloft; upreared.
High-raised,adjective,Elated with great ideas or hopes.
High-reaching,adjective,"Reaching high or upward; hence, ambitious; aspiring."""
High-red,adjective,Of a strong red color.
Highroad,noun,A highway; a much traveled or main road.
High-seasoned,adjective,"Enriched with spice and condiments; hence, exciting; piquant."""
High-sighted,adjective,Looking upward; supercilious.
High-souled,adjective,Having a high or noble spirit; honorable.
High-sounding,adjective,"Pompous; noisy; ostentatious; as, high-sounding words or titles."""
High-spirited,adjective,Full of spirit or natural fire; haughty; courageous; impetuous; not brooking restraint or opposition.
High-stepper,noun,"A horse that moves with a high step or proud gait; hence, a person having a proud bearing."""
High-stomached,adjective,Having a lofty spirit; haughty.
High-strung,adjective,"Strung to a high pitch; spirited; sensitive; as, a high-strung horse."""
High-swelling,adjective,Inflated; boastful.
Hight,noun,A variant of Height.
Hight,unknown,of Hight
Hot,unknown,of Hight
Hight,unknown,of Hight
Hote,unknown,of Hight
Hoten,unknown,of Hight
Hight,verb,To be called or named.
Hight,verb,To command; to direct; to impel.
Hight,verb,To commit; to intrust.
Hight,verb,To promise.
Hightener,noun,That which heightens.
Highth,noun,Variant of Height.
High-toned,adjective,High in tone or sound.
High-toned,adjective,Elevated; high-principled; honorable.
High-top,noun,A ship's masthead.
Highty-tighty,adjective,Hoity-toity.
Highway,noun,A road or way open to the use of the public; a main road or thoroughfare.
Highwaymen,unknown,of Highwayman
Highwayman,noun,One who robs on the public road; a highway robber.
High-wrought,adjective,Wrought with fine art or skill; elaborate.
High-wrought,adjective,"Worked up, or swollen, to a high degree; as, a highwrought passion."""
Higre,noun,See Eagre.
Hig-taper,noun,A plant of the genus Verbascum (V. Thapsus); the common mullein. [Also high-taper and hag-taper.]
Hijera,noun,Alt. of Hijra
Hijra,noun,See Hegira.
Hilal,adjective,Of or pertaining to a hilum.
Hilar,adjective,Belonging to the hilum.
Hilarious,adjective,Mirthful; noisy; merry.
Hilarity,noun,Boisterous mirth; merriment; jollity.
Hilary term,unknown,"Formerly, one of the four terms of the courts of common law in England, beginning on the eleventh of January and ending on the thirty-first of the same month, in each year; -- so called from the festival of St. Hilary, January 13th."""
Hilding,noun,"A base, menial wretch."""
Hilding,adjective,Base; spiritless.
Hile,verb,To hide. See Hele.
Hile,noun,Same as Hilum.
Hill,noun,"A natural elevation of land, or a mass of earth rising above the common level of the surrounding land; an eminence less than a mountain."""
Hill,noun,"The earth raised about the roots of a plant or cluster of plants. [U. S.] See Hill, v. t."""
Hill,verb,"A single cluster or group of plants growing close together, and having the earth heaped up about them; as, a hill of corn or potatoes."""
Hilled,unknown,of Hill
Hilling,noun,of Hill
Hill,verb,"To surround with earth; to heap or draw earth around or upon; as, to hill corn."""
Hilliness,noun,The state of being hilly.
Hilling,noun,The act or process of heaping or drawing earth around plants.
Hillock,noun,A small hill.
Hillside,noun,The side or declivity of a hill.
Hilltop,noun,The top of a hill.
Hilly,adjective,"Abounding with hills; uneven in surface; as, a hilly country."""
Hilly,adjective,"Lofty; as, hilly empire."""
Hilt,noun,"A handle; especially, the handle of a sword, dagger, or the like."""
Hilted,adjective,"Having a hilt; -- used in composition; as, basket-hilted, cross-hilted."""
Hilum,noun,The eye of a bean or other seed; the mark or scar at the point of attachment of an ovule or seed to its base or support; -- called also hile.
Hilum,noun,"The part of a gland, or similar organ, where the blood vessels and nerves enter; the hilus; as, the hilum of the kidney."""
Hilus,noun,"Same as Hilum, 2."""
Him,noun,Them. See Hem.
Him,noun,The objective case of he. See He.
Himalayan,adjective,"Of or pertaining to the Himalayas, the great mountain chain in Hindostan."""
Himpne,noun,A hymn.
Himself,noun,"An emphasized form of the third person masculine pronoun; -- used as a subject usually with he; as, he himself will bear the blame; used alone in the predicate, either in the nominative or objective case; as, it is himself who saved himself."""
Himself,noun,"One's true or real character; one's natural temper and disposition; the state of being in one's right or sane mind (after unconsciousness, passion, delirium, or abasement); as, the man has come to himself."""
Himself,noun,Alt. of Himselven
Himselven,noun,Themselves. See Hemself.
Himselve,noun,See 1st Himself.
Himyaric,adjective,Alt. of Himyaritic
Himyaritic,adjective,"Pertaining to Himyar, an ancient king of Yemen, in Arabia, or to his successors or people; as, the Himjaritic characters, language, etc.; applied esp. to certain ancient inscriptions showing the primitive type of the oldest form of the Arabic, still spoken in Southern Arabia."""
Hin,noun,"A Hebrew measure of liquids, containing three quarts, one pint, one gill, English measure."""
Hind,noun,"The female of the red deer, of which the male is the stag."""
Hind,noun,"A spotted food fish of the genus Epinephelus, as E. apua of Bermuda, and E. Drummond-hayi of Florida; -- called also coney, John Paw, spotted hind."""
Hind,noun,A domestic; a servant.
Hind,noun,A peasant; a rustic; a farm servant.
Hind,adjective,"In the rear; -- opposed to front; of or pertaining to the part or end which follows or is behind, in opposition to the part which leads or is before; as, the hind legs or hind feet of a quadruped; the hind man in a procession."""
Hindberry,noun,The raspberry.
Hindbrain,noun,"The posterior of the three principal divisions of the brain, including the epencephalon and metencephalon. Sometimes restricted to the epencephalon only."""
Hinder,adjective,"Of or belonging to that part or end which is in the rear, or which follows; as, the hinder part of a wagon; the hinder parts of a horse."""
Hindered,unknown,of Hinder
Hindering,noun,of Hinder
Hinder,adjective,"To keep back or behind; to prevent from starting or moving forward; to check; to retard; to obstruct; to bring to a full stop; -- often followed by from; as, an accident hindered the coach; drought hinders the growth of plants; to hinder me from going."""
Hinder,adjective,To prevent or embarrass; to debar; to shut out.
