Hornito,noun,"A low, oven-shaped mound, common in volcanic regions, and emitting smoke and vapors from its sides and summit."""
Hornless,adjective,Having no horn.
Horn-mad,adjective,Quite mad; -- raving crazy.
Hornotine,noun,A yearling; a bird of the year.
Hornowl,noun,See Horned Owl.
Hornpike,noun,The garfish.
Hornpipe,noun,"An instrument of music formerly popular in Wales, consisting of a wooden pipe, with holes at intervals. It was so called because the bell at the open end was sometimes made of horn."""
Hornpipe,noun,"A lively tune played on a hornpipe, for dancing; a tune adapted for such playing."""
Hornpout,noun,"See Horned pout, under Horned."""
Hornsnake,noun,"A harmless snake (Farancia abacura), found in the Southern United States. The color is bluish black above, red below."""
Hornstone,noun,"A siliceous stone, a variety of quartz, closely resembling flint, but more brittle; -- called also chert."""
Horntail,noun,"Any one of family (Uroceridae) of large hymenopterous insects, allied to the sawflies. The larvae bore in the wood of trees. So called from the long, stout ovipositors of the females."""
Hornwork,noun,An outwork composed of two demibastions joined by a curtain. It is connected with the works in rear by long wings.
Hornwort,noun,"An aquatic plant (Ceratophyllum), with finely divided leaves."""
Hornwrack,noun,A bryozoan of the genus Flustra.
Horny,unknown,Having horns or hornlike projections.
Horny,unknown,"Composed or made of horn, or of a substance resembling horn; of the nature of horn."""
Horny,unknown,Hard; callous.
Horny-handed,adjective,Having the hands horny and callous from labor.
Hornyhead,noun,"Any North American river chub of the genus Hybopsis, esp. H. biguttatus."""
Horography,noun,An account of the hours.
Horography,noun,"The art of constructing instruments for making the hours, as clocks, watches, and dials."""
Horologe,noun,A servant who called out the hours.
Horologe,noun,"An instrument indicating the time of day; a timepiece of any kind; a watch, clock, or dial."""
Horologer,noun,A maker or vender of clocks and watches; one skilled in horology.
Horological,adjective,"Relating to a horologe, or to horology."""
Horologiographer,noun,"A maker of clocks, watches, or dials."""
Horologiographic,adjective,Of or pertaining to horologiography.
Horologiography,noun,An account of instruments that show the hour.
Horologiography,noun,The art of constructing clocks or dials; horography.
Horologist,noun,One versed in horology.
Horology,noun,"The science of measuring time, or the principles and art of constructing instruments for measuring and indicating portions of time, as clocks, watches, dials, etc."""
Horometer,noun,An instrument for measuring time.
Horometrical,adjective,Belonging to horometry.
Horometry,noun,"The art, practice, or method of measuring time by hours and subordinate divisions."""
Horopter,noun,"The line or surface in which are situated all the points which are seen single while the point of sight, or the adjustment of the eyes, remains unchanged."""
Horopteric,adjective,Of or pertaining to the horopter.
Horoscope,noun,"The representation made of the aspect of the heavens at the moment of a person's birth, by which the astrologer professed to foretell the events of the person's life; especially, the sign of the zodiac rising above the horizon at such a moment."""
Horoscope,noun,"The diagram or scheme of twelve houses or signs of the zodiac, into which the whole circuit of the heavens was divided for the purposes of such prediction of fortune."""
Horoscope,noun,The planisphere invented by Jean Paduanus.
Horoscope,noun,A table showing the length of the days and nights at all places.
Horoscoper,noun,Alt. of Horoscopist
Horoscopist,noun,One versed in horoscopy; an astrologer.
Horoscopy,noun,"The art or practice of casting horoscopes, or observing the disposition of the stars, with a view to prediction events."""
Horoscopy,noun,Aspect of the stars at the time of a person's birth.
Horrendous,adjective,Fearful; frightful.
Horrent,adjective,"Standing erect, as bristles; covered with bristling points; bristled; bristling."""
Horrible,adjective,"Exciting, or tending to excite, horror or fear; dreadful; terrible; shocking; hideous; as, a horrible sight; a horrible story; a horrible murder."""
Horribleness,noun,The state or quality of being horrible; dreadfulness; hideousness.
Horribly,verb,In a manner to excite horror; dreadfully; terribly.
Horrid,adjective,Rough; rugged; bristling.
Horrid,adjective,"Fitted to excite horror; dreadful; hideous; shocking; hence, very offensive."""
Horridly,verb,In a horrid manner.
Horridness,noun,The quality of being horrid.
Horrific,adjective,Causing horror; frightful.
Horrification,noun,That which causes horror.
Horrified,unknown,of Horrify
Horrifying,noun,of Horrify
Horrify,verb,"To cause to feel horror; to strike or impress with horror; as, the sight horrified the beholders."""
Horripilation,noun,"A real or fancied bristling of the hair of the head or body, resulting from disease, terror, chilliness, etc."""
Horrisonant,adjective,Horrisonous.
Horrisonous,adjective,Sounding dreadfully; uttering a terrible sound.
Horror,noun,A bristling up; a rising into roughness; tumultuous movement.
Horror,noun,"A shaking, shivering, or shuddering, as in the cold fit which precedes a fever; in old medical writings, a chill of less severity than a rigor, and more marked than an algor."""
Horror,noun,"A painful emotion of fear, dread, and abhorrence; a shuddering with terror and detestation; the feeling inspired by something frightful and shocking."""
Horror,noun,"That which excites horror or dread, or is horrible; gloom; dreariness."""
Horror-sticken,adjective,Struck with horror; horrified.
Horror-struck,adjective,Horror-stricken; horrified.
Hors de combat,unknown,Out of the combat; disabled from fighting.
Horse,noun,"A hoofed quadruped of the genus Equus; especially, the domestic horse (E. caballus), which was domesticated in Egypt and Asia at a very early period. It has six broad molars, on each side of each jaw, with six incisors, and two canine teeth, both above and below. The mares usually have the canine teeth rudimentary or wanting. The horse differs from the true asses, in having a long, flowing mane, and the tail bushy to the base. Unlike the asses it has callosities, or chestnuts, on all its legs. The horse excels in strength, speed, docility, courage, and nobleness of character, and is used for drawing, carrying, bearing a rider, and like purposes."""
Horse,noun,"The male of the genus horse, in distinction from the female or male; usually, a castrated male."""
Horse,noun,"Mounted soldiery; cavalry; -- used without the plural termination; as, a regiment of horse; -- distinguished from foot."""
Horse,noun,"A frame with legs, used to support something; as, a clotheshorse, a sawhorse, etc."""
Horse,noun,"A frame of timber, shaped like a horse, on which soldiers were made to ride for punishment."""
Horse,noun,"Anything, actual or figurative, on which one rides as on a horse; a hobby."""
Horse,noun,"A mass of earthy matter, or rock of the same character as the wall rock, occurring in the course of a vein, as of coal or ore; hence, to take horse -- said of a vein -- is to divide into branches for a distance."""
Horse,noun,"See Footrope, a."""
Horse,adjective,A breastband for a leadsman.
Horse,adjective,An iron bar for a sheet traveler to slide upon.
Horse,adjective,A jackstay.
Horsed,unknown,of Horse
Horsing,noun,of Horse
Horse,verb,"To provide with a horse, or with horses; to mount on, or as on, a horse."""
Horse,verb,To sit astride of; to bestride.
Horse,verb,"To cover, as a mare; -- said of the male."""
Horse,verb,"To take or carry on the back; as, the keeper, horsing a deer."""
Horse,verb,"To place on the back of another, or on a wooden horse, etc., to be flogged; to subject to such punishment."""
Horse,verb,To get on horseback.
Horseback,noun,The back of a horse.
Horseback,noun,"An extended ridge of sand, gravel, and bowlders, in a half-stratified condition."""
Horse-chestnut,noun,"The large nutlike seed of a species of Aesculus (Ae. Hippocastanum), formerly ground, and fed to horses, whence the name."""
Horse-chestnut,noun,"The tree itself, which was brought from Constantinople in the beginning of the sixteenth century, and is now common in the temperate zones of both hemispheres. The native American species are called buckeyes."""
Horse-drench,noun,A dose of physic for a horse.
Horse-drench,noun,The appliance by which the dose is administred.
Horsefish,noun,The moonfish (Selene setipinnis).
Horsefish,noun,The sauger.
Horseflesh,noun,The flesh of horses.
Horseflesh,noun,"Horses, generally; the qualities of a horse; as, he is a judge of horseflesh."""
Horseflies,unknown,of Horsefly
Horsefly,noun,"Any dipterous fly of the family Tabanidae, that stings horses, and sucks their blood."""
Horsefly,noun,The horse tick or forest fly (Hippobosca).
Horsefeet,unknown,of Horsefoot
Horsefoot,noun,The coltsfoot.
Horsefoot,noun,The Limulus or horseshoe crab.
Horse Guards,unknown,"A body of cavalry so called; esp., a British regiment, called the Royal Horse Guards, which furnishes guards of state for the sovereign."""
Horsehair,noun,"A hair of a horse, especially one from the mane or tail; the hairs of the mane or tail taken collectively; a fabric or tuft made of such hairs."""
Horsehead,noun,The silver moonfish (Selene vomer).
Horsehide,noun,The hide of a horse.
Horsehide,noun,Leather made of the hide of a horse.
Horse-jockey,noun,A professional rider and trainer of race horses.
Horse-jockey,noun,A trainer and dealer in horses.
Horseknop,noun,Knapweed.
Horselaugh,noun,"A loud, boisterous laugh; a guffaw."""
Horse-leech,noun,"A large blood-sucking leech (Haemopsis vorax), of Europe and Northern Africa. It attacks the lips and mouths of horses."""
Horse-leech,noun,A farrier; a veterinary surgeon.
Horse-leechery,noun,"The business of a farrier; especially, the art of curing the diseases of horses."""
Horse-litter,noun,"A carriage hung on poles, and borne by and between two horses."""
Horsemen,unknown,of Horseman
Horseman,noun,A rider on horseback; one skilled in the management of horses; a mounted man.
Horseman,noun,A mounted soldier; a cavalryman.
Horseman,noun,"A land crab of the genus Ocypoda, living on the coast of Brazil and the West Indies, noted for running very swiftly."""
Horseman,noun,"A West Indian fish of the genus Eques, as the light-horseman (E. lanceolatus)."""
Horsemanship,noun,"The act or art of riding, and of training and managing horses; manege."""
Horsemint,noun,A coarse American plant of the Mint family (Monarda punctata).
Horsemint,noun,"In England, the wild mint (Mentha sylvestris)."""
Horsenail,noun,"A thin, pointed nail, with a heavy flaring head, for securing a horsehoe to the hoof; a horsehoe nail."""
Horseplay,noun,"Rude, boisterous play."""
Horsepond,noun,A pond for watering horses.
Horse power,unknown,The power which a horse exerts.
Horse power,unknown,"A unit of power, used in stating the power required to drive machinery, and in estimating the capabilities of animals or steam engines and other prime movers for doing work. It is the power required for the performance of work at the rate of 33,000 English units of work per minute; hence, it is the power that must be exerted in lifting 33,000 pounds at the rate of one foot per minute, or 550 pounds at the rate of one foot per second, or 55 pounds at the rate of ten feet per second, etc."""
Horse power,unknown,"A machine worked by a horse, for driving other machinery; a horse motor."""
Horse-radish,noun,"A plant of the genus Nasturtium (N. Armoracia), allied to scurvy grass, having a root of a pungent taste, much used, when grated, as a condiment and in medicine."""
Horserake,noun,A rake drawn by a horse.
Horseshoe,noun,"A shoe for horses, consisting of a narrow plate of iron in form somewhat like the letter U, nailed to a horse's hoof."""
Horseshoe,noun,Anything shaped like a horsehoe crab.
Horseshoe,noun,The Limulus of horsehoe crab.
Horseshoer,noun,One who shoes horses.
Horseshoeing,noun,The act or employment of shoeing horses.
Horsetail,noun,"A leafless plant, with hollow and rushlike stems. It is of the genus Equisetum, and is allied to the ferns. See Illust. of Equisetum."""
Horsetail,noun,"A Turkish standard, denoting rank."""
Horseweed,noun,"A composite plant (Erigeron Canadensis), which is a common weed."""
Horsewhip,noun,A whip for horses.
Horsewhip,verb,To flog or chastise with a horsewhip.
Horsewomen,unknown,of Horsewoman
Horsewoman,noun,A woman who rides on horseback.
Horsewood,noun,"A West Indian tree (Calliandra latifolia) with showy, crimson blossoms."""
Horseworm,noun,The larva of a botfly.
Horsiness,noun,The condition or quality of being a horse; that which pertains to a horse.
Horsiness,noun,"Fondness for, or interest in, horses."""
Horsly,adjective,Horselike.
Horsy,adjective,"Pertaining to, or suggestive of, a horse, or of horse racing; as, horsy manners; garments of fantastically horsy fashions."""
Hortation,noun,"The act of exhorting, inciting, or giving advice; exhortation."""
Hortative,adjective,Giving exhortation; advisory; exhortative.
Hortative,noun,An exhortation.
Hortatory,adjective,"Giving exhortation or advise; encouraging; exhortatory; inciting; as, a hortatory speech."""
Hortensial,adjective,Fit for a garden.
Horticultor,noun,One who cultivates a garden.
Horticultural,adjective,"Of or pertaining to horticulture, or the culture of gardens or orchards."""
Horticulture,noun,The cultivation of a garden or orchard; the art of cultivating gardens or orchards.
Horticulturist,noun,One who practices horticulture.
Hortulan,adjective,Belonging to a garden.
Hortus siccus,unknown,"A collection of specimens of plants, dried and preserved, and arranged systematically; an herbarium."""
Hortyard,noun,An orchard.
Hosannas,unknown,of Hosanna
Hosanna,noun,"A Hebrew exclamation of praise to the Lord, or an invocation of blessings."""
Hose,unknown,of Hose
Hosen,unknown,of Hose
Hose,noun,"Close-fitting trousers or breeches, as formerly worn, reaching to the knee."""
Hose,noun,Covering for the feet and lower part of the legs; a stocking or stockings.
Hose,noun,"A flexible pipe, made of leather, India rubber, or other material, and used for conveying fluids, especially water, from a faucet, hydrant, or fire engine."""
Hosen,noun,See Hose.
Hosier,noun,"One who deals in hose or stocking, or in goods knit or woven like hose."""
Hosiery,noun,The business of a hosier.
Hosiery,noun,"Stockings, in general; goods knit or woven like hose."""
Hospice,noun,"A convent or monastery which is also a place of refuge or entertainment for travelers on some difficult road or pass, as in the Alps; as, the Hospice of the Great St. Bernard."""
Hospitable,adjective,Receiving and entertaining strangers or guests with kindness and without reward; kind to strangers and guests; characterized by hospitality.
Hospitable,adjective,"Proceeding from or indicating kindness and generosity to guests and strangers; as, hospitable rites."""
Hospitableness,noun,The quality of being hospitable; hospitality.
Hospitably,verb,In a hospitable manner.
Hospitage,noun,Hospitality.
Hospital,noun,A place for shelter or entertainment; an inn.
Hospital,noun,"A building in which the sick, injured, or infirm are received and treated; a public or private institution founded for reception and cure, or for the refuge, of persons diseased in body or mind, or disabled, infirm, or dependent, and in which they are treated either at their own expense, or more often by charity in whole or in part; a tent, building, or other place where the sick or wounded of an army cared for."""
Hospital,adjective,Hospitable.
Hospitaler,noun,"One residing in a hospital, for the purpose of receiving the poor, the sick, and strangers."""
Hospitaler,noun,"One of an order of knights who built a hospital at Jerusalem for pilgrims, A. D. 1042. They were called Knights of St. John of Jerusalem, and after the removal of the order to Malta, Knights of Malta."""
Hospitalism,noun,"A vitiated condition of the body, due to long confinement in a hospital, or the morbid condition of the atmosphere of a hospital."""
Hospitalities,unknown,of Hospitality
Hospitality,noun,"The act or practice of one who is hospitable; reception and entertainment of strangers or guests without reward, or with kind and generous liberality."""
Hospitalize,verb,"To render (a building) unfit for habitation, by long continued use as a hospital."""
Hospitate,verb,To receive hospitality; to be a guest.
Hospitate,verb,To receive with hospitality; to lodge as a guest.
Hospitium,noun,An inn; a lodging; a hospice.
Hospitium,noun,An inn of court.
Hospodar,noun,A title borne by the princes or governors of Moldavia and Wallachia before those countries were united as Roumania.
Host,noun,"The consecrated wafer, believed to be the body of Christ, which in the Mass is offered as a sacrifice; also, the bread before consecration."""
Host,noun,An army; a number of men gathered for war.
Host,noun,Any great number or multitude; a throng.
Host,noun,"One who receives or entertains another, whether gratuitously or for compensation; one from whom another receives food, lodging, or entertainment; a landlord."""
Host,verb,To give entertainment to.
Host,verb,To lodge at an inn; to take up entertainment.
Hostage,noun,"A person given as a pledge or security for the performance of the conditions of a treaty or stipulations of any kind, on the performance of which the person is to be released."""
Hostel,noun,An inn.
Hostel,noun,"A small, unendowed college in Oxford or Cambridge."""
Hosteler,noun,The keeper of a hostel or inn.
Hosteler,noun,"A student in a hostel, or small unendowed collede in Oxford or Cambridge."""
Hostelry,noun,An inn; a lodging house.
Hostess,noun,A female host; a woman who hospitably entertains guests at her house.
Hostess,noun,A woman who entertains guests for compensation; a female innkeeper.
Hostess-ship,noun,"The character, personality, or office of a hostess."""
Hostie,noun,The consecrated wafer; the host.
Hostile,adjective,"Belonging or appropriate to an enemy; showing the disposition of an enemy; showing ill will and malevolence, or a desire to thwart and injure; occupied by an enemy or enemies; inimical; unfriendly; as, a hostile force; hostile intentions; a hostile country; hostile to a sudden change."""
Hostile,noun,"An enemy; esp., an American Indian in arms against the whites; -- commonly in the plural."""
Hostilely,verb,In a hostile manner.
Hostilities,unknown,of Hostility
Hostility,noun,State of being hostile; public or private enemy; unfriendliness; animosity.
Hostility,noun,"An act of an open enemy; a hostile deed; especially in the plural, acts of warfare; attacks of an enemy."""
Hostilize,verb,To make hostile; to cause to become an enemy.
Hosting,noun,An encounter; a battle.
Hosting,noun,A muster or review.
Hostler,noun,An innkeeper. [Obs.] See Hosteler.
Hostler,noun,"The person who has the care of horses at an inn or stable; hence, any one who takes care of horses; a groom; -- so called because the innkeeper formerly attended to this duty in person."""
Hostler,noun,The person who takes charge of a locomotive when it is left by the engineer after a trip.
Hostless,adjective,Inhospitable.
Hostry,noun,A hostelry; an inn or lodging house.
Hostry,noun,A stable for horses.
Hot,unknown,imp. & p. p. of Hote.
Hot,unknown,"Having much sensible heat; exciting the feeling of warmth in a great degree; very warm; -- opposed to cold, and exceeding warm in degree; as, a hot stove; hot water or air."""
Hot,unknown,"Characterized by heat, ardor, or animation; easily excited; firely; vehement; passionate; violent; eager."""
Hot,unknown,Lustful; lewd; lecherous.
Hot,unknown,"Acrid; biting; pungent; as, hot as mustard."""
Hotbed,noun,"A bed of earth heated by fermenting manure or other substances, and covered with glass, intended for raising early plants, or for nourishing exotics."""
Hotbed,noun,"A place which favors rapid growth or development; as, a hotbed of sedition."""
Hot blast,unknown,See under Blast.
Hot-blooded,adjective,Having hot blood; excitable; high-spirited; irritable; ardent; passionate.
Hot-brained,adjective,"Ardent in temper; violent; rash; impetuous; as, hot-brained youth."""
Hotchpot,noun,Alt. of Hotchpotch
Hotchpotch,noun,A mingled mass; a confused mixture; a stew of various ingredients; a hodgepodge.
Hotchpotch,noun,"A blending of property for equality of division, as when lands given in frank-marriage to one daughter were, after the death of the ancestor, blended with the lands descending to her and to her sisters from the same ancestor, and then divided in equal portions among all the daughters. In modern usage, a mixing together, or throwing into a common mass or stock, of the estate left by a person deceased and the amounts advanced to any particular child or children, for the purpose of a more equal division, or of equalizing the shares of all the children; the property advanced being accounted for at its value when given."""
Hotcockles,noun,"A childish play, in which one covers his eyes, and guesses who strikes him or his hand placed behind him."""
Hatte,unknown,of Hote
Hot,unknown,of Hote
Hote,unknown,of Hote
Hoten,unknown,of Hote
Hot,unknown,of Hote
Hote,verb,To command; to enjoin.
Hote,verb,To promise.
Hote,verb,To be called; to be named.
Hotel,noun,"A house for entertaining strangers or travelers; an inn or public house, of the better class."""
Hotel,noun,"In France, the mansion or town residence of a person of rank or wealth."""
Hotel-de-ville,noun,A city hall or townhouse.
Hotel-Dieu,noun,A hospital.
Hoten,unknown,p. p. of Hote.
Hotfoot,verb,In haste; foothot.
Hot-head,noun,"A violent, passionate person; a hasty or impetuous person; as, the rant of a hot-head."""
Hot-headed,adjective,Fiery; violent; rash; hasty; impetuous; vehement.
Hothouse,noun,"A house kept warm to shelter tender plants and shrubs from the cold air; a place in which the plants of warmer climates may be reared, and fruits ripened."""
Hothouse,noun,"A bagnio, or bathing house."""
Hothouse,noun,A brothel; a bagnio.
Hothouse,noun,A heated room for drying green ware.
Hot-livered,adjective,Of an excitable or irritable temperament; irascible.
Hotly,adjective,"In a hot or fiery manner; ardently; vehemently; violently; hastily; as, a hotly pursued."""
Hotly,adjective,In a lustful manner; lustfully.
Hot-mouthed,adjective,Headstrong.
Hotness,noun,The quality or state of being hot.
Hotness,noun,Heat or excitement of mind or manner; violence; vehemence; impetuousity; ardor; fury.
Hotpress,verb,"To apply to, in conjunction with mechanical pressure, for the purpose of giving a smooth and glosay surface, or to express oil, etc.; as, to hotpress paper, linen, etc."""
Hotpressed,adjective,"Pressed while heat is applied. See Hotpress, v. t."""
Hot-short,adjective,"More or less brittle when heated; as, hot-short iron."""
Hot-spirited,adjective,Having a fiery spirit; hot-headed.
Hotspur,noun,"A rash, hot-headed man."""
Hotspur,adjective,Alt. of Hotspurred
Hotspurred,adjective,Violent; impetuous; headstrong.
Hottentot,noun,"One of a degraded and savage race of South Africa, with yellowish brown complexion, high cheek bones, and wooly hair growing in tufts."""
Hottentot,noun,"The language of the Hottentots, which is remarkable for its clicking sounds."""
Hottentotism,noun,A term employed to describe one of the varieties of stammering.
Houdah,noun,See Howdah.
Hough,noun,"Same as Hock, a joint."""
Houghed,unknown,of Hough
Houghing,noun,of Hough
Hough,verb,"Same as Hock, to hamstring."""
Hough,noun,An adz; a hoe.
Hough,verb,To cut with a hoe.
Houlet,noun,An owl. See Howlet.
Hoult,noun,A piece of woodland; a small wood. [Obs.] See Holt.
Hound,noun,"A variety of the domestic dog, usually having large, drooping ears, esp. one which hunts game by scent, as the foxhound, bloodhound, deerhound, but also used for various breeds of fleet hunting dogs, as the greyhound, boarhound, etc."""
Hound,noun,A despicable person.
Hound,noun,A houndfish.
Hound,noun,"Projections at the masthead, serving as a support for the trestletrees and top to rest on."""
Hound,noun,A side bar used to strengthen portions of the running gear of a vehicle.
Hounded,unknown,of Hound
Hounding,noun,of Hound
Hound,verb,"To set on the chase; to incite to pursuit; as, to hounda dog at a hare; to hound on pursuers."""
Hound,verb,"To hunt or chase with hounds, or as with hounds."""
Houndfish,noun,"Any small shark of the genus Galeus or Mustelus, of which there are several species, as the smooth houndfish (G. canis), of Europe and America; -- called also houndshark, and dogfish."""
Hounding,noun,The act of one who hounds.
Hounding,noun,The part of a mast below the hounds and above the deck.
Hound's-tongue,noun,"A biennial weed (Cynoglossum officinale), with soft tongue-shaped leaves, and an offensive odor. It bears nutlets covered with barbed or hooked prickles. Called also dog's-tongue."""
Houp,noun,See Hoopoe.
Hour,noun,The twenty-fourth part of a day; sixty minutes.
Hour,noun,"The time of the day, as expressed in hours and minutes, and indicated by a timepiece; as, what is the hour? At what hour shall we meet?"""
Hour,noun,"Fixed or appointed time; conjuncture; a particular time or occasion; as, the hour of greatest peril; the man for the hour."""
Hour,noun,"Certain prayers to be repeated at stated times of the day, as matins and vespers."""
Hour,noun,A measure of distance traveled.
