unavowed,adjective,not openly or publicly declared; unstated.
unawakened,adjective,not aware of or roused to particular sensations or feelings.
unaware,adverb,variant of unawares.
unaware,adjective,having no knowledge of a situation or fact.
unawareness,,"the state of being unaware or uninformed <the college-educated couple's smug unawareness of current events was both surprising and sad> Synonyms benightedness, cluelessness, incognizance, innocence, nescience, obliviousness, unawareness, unfamiliarity."
unawares,adverb,without being aware of a situation.
unawed,adjective,not filled with awe.
unbacked,adjective,"having no financial, material, or moral support."
unbaked,adjective,not baked.
unbalance,verb,make (someone or something) unsteady so that they tip or fall.
unbalanced,adjective,(of a person) emotionally or mentally disturbed.
unbalanced,adjective,"not giving accurate, fair, or equal coverage to all aspects; partial."
unbalanced,verb,make (someone or something) unsteady so that they tip or fall.
unbalanced,verb,upset or disturb the equilibrium of (a situation or person's state of mind).
unbalancing,verb,make (someone or something) unsteady so that they tip or fall.
unbaptized,adjective,not having been baptized.
unbar,verb,remove the bars from (a gate or door); unlock.
unbarred,verb,remove the bars from (a gate or door); unlock.
unbarring,verb,remove the bars from (a gate or door); unlock.
unbars,verb,remove the bars from (a gate or door); unlock.
unbearable,adjective,not able to be endured or tolerated.
unbeatable,adjective,not able to be defeated or bettered in a contest or commercial market.
unbeaten,adjective,not defeated or surpassed.
unbecoming,adjective,(especially of clothing or a colour) not flattering.
unbecoming,adjective,(of behaviour) not fitting or appropriate; unseemly.
unbefitting,adjective,not appropriate; unsuitable.
unbeholden,adjective,owing no one any duty or thanks; free of any obligation.
unbeknown,adjective,without the knowledge of (someone).
unbeknownst,adjective,without the knowledge of (someone).
unbelief,noun,lack of religious belief; an absence of faith.
unbelievable,adjective,not able to be believed; unlikely to be true.
unbelievable,adjective,so great or extreme as to be difficult to believe; extraordinary.
unbelievably,,Definition of UNBELIEVABLE for Kids. 1. : too unlikely to be believed <an unbelievable excuse> : very impressive or amazing <an unbunbeliever,noun,"someone who has no religious beliefs, or who does not follow a particular religion."
unbelievers,noun,"someone who has no religious beliefs, or who does not follow a particular religion."
unbelieving,adjective,not believing someone or something; incredulous.
unbeloved,adjective,not loved.
unbend,verb,make or become straight from a bent or twisted form or position.
unbendable,adjective,not able to be bent; stiff.
unbending,adjective,"reserved, formal, or strict in one's behaviour or attitudes; austere and inflexible."
unbending,verb,make or become straight from a bent or twisted form or position.
unbends,verb,make or become straight from a bent or twisted form or position.
unbent,verb,make or become straight from a bent or twisted form or position.
unbiased,adjective,showing no prejudice for or against something; impartial.
unbid,,"· den. (ŭn-bĭd′n) also un·bid (-bĭd′) adj. Not invited, asked, or requested; unasked: unbidden guests; comments unbid and unwelcome."
unbiddable,adjective,not easily controlled; unruly or disobedient.
unbidden,adjective,without having been commanded or invited.
unbind,verb,release from bonds or restraints.
unbinding,verb,release from bonds or restraints.
unbinds,verb,release from bonds or restraints.
unbleached,adjective,(especially of paper or cloth) not made whiter or lighter by a chemical process.
unblemished,adjective,not damaged or marked in any way.
unblended,adjective,not mixed with other types of the same substance.
unblessed,adjective,not blessed.
unblinking,adjective,(of a person or their eyes) not blinking.
unblock,verb,"remove an obstruction from (something, especially a pipe or drain)."
unblocked,verb,"remove an obstruction from (something, especially a pipe or drain)."
unblocking,verb,"remove an obstruction from (something, especially a pipe or drain)."
unblocks,verb,"remove an obstruction from (something, especially a pipe or drain)."
unblushing,adjective,not feeling or showing embarrassment or shame.
unblushingly,,"Definition of UNBLUSHING. 1. : not blushing. : shameless, unabashed <unblushing greed> — un·blush·ing·ly \-shiŋ-lē\ adverb."
unbodied,,: having no body : incorporeal; also : freed from the body <unbodied souls> : formless.
unbolt,verb,open (a door or window) by drawing back a bolt.
unbolted,adjective,(of a door or window) not bolted.
unbooked,adjective,"(of a ticket, accommodation, etc.) not yet booked."
unborn,adjective,(of a baby) not yet born.
unbosom,verb,disclose (one's thoughts or secrets).
unbosomed,verb,disclose (one's thoughts or secrets).
unbosoming,verb,disclose (one's thoughts or secrets).
unbosoms,verb,disclose (one's thoughts or secrets).
unbothered,adjective,lacking concern about something.
unbound,adjective,not bound or tied up.
unbound,verb,release from bonds or restraints.
unbounded,adjective,having or appearing to have no limits.
unboundedly,,": having no limit <unbounded joy> : unrestrained, uncontrolled. — un·bound·ed·ness noun. See unbounded defined for English-language learners."
unbowed,adjective,not having submitted to pressure or demands.
unbox,,"Unboxing is the unpacking of new products, especially high tech consumer products. The product's owner captures the process on video and later uploads it to the web."
unbraiding,verb,untie (a braid).
unbranded,adjective,(of a product) not bearing a brand name.
unbreakable,adjective,not liable to break or able to be broken easily.
unbred,,Definition of UNBRED. 1. obsolete : ill-bred. : not taught : untrained. 3.
unbribable,adjective,(of a person) not susceptible to bribery.
unbridgeable,adjective,(of a gap or difference) not able to be bridged or made less significant.
unbridle,adjective,uncontrolled; unconstrained.
unbridle,verb,remove the bridle from (a horse).
unbridled,verb,remove the bridle from (a horse).
unbridled,adjective,uncontrolled; unconstrained.
unbridles,adjective,uncontrolled; unconstrained.
unbridles,verb,remove the bridle from (a horse).
unbroken,adjective,"not broken, fractured, or damaged."
unbroken,adjective,not interrupted or disturbed; continuous.
unbroken,adjective,(of a horse) not tamed or accustomed to being ridden.
unbroken,adjective,(of land) not cultivated.
unbruised,adjective,not bruised.
unbrushed,adjective,not brushed; untidy or unkempt.
unbuckle,verb,"unfasten the buckle of (something, especially a belt or shoe)."
unbuckled,verb,"unfasten the buckle of (something, especially a belt or shoe)."
unbuckles,verb,"unfasten the buckle of (something, especially a belt or shoe)."
unbuckling,verb,"unfasten the buckle of (something, especially a belt or shoe)."
unbudgeable,adjective,not able to be moved.
unbudging,,Definition of UNBUDGING. : not budging : resisting movement or change. — un·budg·ing·ly \-jiŋ-lē\ adverb.
unbuild,verb,"demolish or destroy (something, especially a building)."
unbuilding,verb,"demolish or destroy (something, especially a building)."
unburden,verb,relieve (someone) of a burden.
unburdened,adjective,not burdened or encumbered.
unburdening,verb,relieve (someone) of a burden.
unburdens,verb,relieve (someone) of a burden.
unbury,verb,remove (something) from under the ground.
unburied,adjective,(especially of a dead body) not buried.
unburnable,adjective,consisting or made of material that does not burn if exposed to fire.
unburned,adjective,not damaged or destroyed by fire.
unburnished,adjective,(of a metal surface) not polished; dull.
unburnt,adjective,not damaged or destroyed by fire.
unbusinesslike,adjective,not businesslike.
unbuttered,adjective,not spread or coated with butter.
unbutton,verb,unfasten the buttons of (a garment).
unbuttoned,verb,unfasten the buttons of (a garment).
unbuttoning,verb,unfasten the buttons of (a garment).
unbuttons,verb,unfasten the buttons of (a garment).
uncage,verb,release from a cage.
uncalculated,adjective,(of an action) done without full consideration of the likely consequences.
uncanny,adjective,"strange or mysterious, especially in an unsettling way."
uncannier,adjective,"strange or mysterious, especially in an unsettling way."
uncanniest,adjective,"strange or mysterious, especially in an unsettling way."
uncannily,,"a : seeming to have a supernatural character or origin : eerie, mysterious. b : being beyond what is normal or expected : suggesting superhuman or supernatural powers <an uncanny sense of direction>"
uncanonical,adjective,not conforming to or ordered by canon law.
uncap,verb,remove the lid or cover from.
uncapped,adjective,"(of a player) never having been chosen as a member of a particular sports team, especially a national one."
uncapping,verb,remove the lid or cover from.
uncaps,verb,remove the lid or cover from.
uncaring,adjective,not displaying sympathy or concern for others.
uncaring,adjective,not feeling interest in or attaching importance to something.
uncarpeted,adjective,(of a floor) not covered with a carpet.
uncase,verb,remove from a cover or case.
uncashed,adjective,(of a cheque or money order) not yet cashed.
uncaught,adjective,not caught.
unceasing,adjective,not coming to an end; continuous.
unceasingly,,"Full Definition of UNCEASING. : never ceasing : continuous, incessant <unceasing efforts> <unceasing vigilance> — un·ceas·ing·ly \-siŋ-lē\ adverb."
uncelebrated,adjective,not publicly acclaimed.
uncensored,adjective,not censored.
unceremonious,adjective,having or showing a lack of courtesy; rough or abrupt.
unceremoniously,,": not ceremonious : informal. : abrupt, rude unceremonious dismissal> — un·cer·e·mo·ni·ous·ly adverb. — un·cer·e·mo·ni·ous·ness noun. See unceremonious defined for English-language learners."
unceremoniousness,,": not ceremonious : informal. : abrupt, rude unceremonious dismissal> — un·cer·e·mo·ni·ous·ly adverb. — un·cer·e·mo·ni·ous·ness noun. See unceremonious defined for English-language learners."
uncertain,adjective,not able to be relied on; not known or definite.
uncertainly,,"c.1300, ""of indeterminate time or occurrence,"" from un- (1) ""not"" + certain (adj.). Meaning ""not fully confident"" is recorded from late 14c. (implied in uncertainty). Related: Uncertainly."
uncertainty,noun,the state of being uncertain.
uncertainties,noun,the state of being uncertain.
uncertificated,adjective,not officially recognized as possessing certain qualifications or meeting certain standards.
uncertified,adjective,not officially recognized as having a certain status or meeting certain standards.
unchain,verb,remove the chains fastening or securing (someone or something).
unchained,verb,remove the chains fastening or securing (someone or something).
unchaining,verb,runchains,verb,remove the chains fastening or securing (someone or something).
unchallengeable,adjective,"not able to be disputed, opposed, or defeated."
unchallenged,adjective,not disputed or questioned.
unchallenged,adjective,(especially of a person in power) not opposed or defeated.
unchallenging,adjective,(of a task or situation) not testing one's abilities.
unchancy,adjective,"unlucky, inauspicious, or dangerous."
unchangeable,adjective,not liable to variation or able to be altered.
unchanged,adjective,not changed; unaltered.
unchanging,adjective,not changing; remaining the same.
unchaperoned,adjective,unaccompanied or unsupervised.
uncharacteristic,adjective,not typical of a particular person or thing.
uncharged,adjective,not having an electric charge.
uncharitable,adjective,(of a person's behaviour or attitude towards others) unkind; unsympathetic.
uncharitableness,,Full Definition of UNCHARITABLE. : lacking in charity : severe in judging : harsh <uncharitable comments> — un·char·i·ta·ble·ness noun. — un·char·i·ta·bly \-blē\ adverb.
uncharitably,,Full Definition of UNCHARITABLE. : lacking in charity : severe in judging : harsh <uncharitable comments> — un·char·i·ta·ble·ness noun. — un·char·i·ta·bly \-blē\ adverb.
uncharted,adjective,(of an area of land or sea) not mapped or surveyed.
unchartered,adjective,not having a charter or written constitution.
unchaste,adjective,"relating to or engaging in sexual activity, especially of an illicit or extramarital nature."
unchastely,,Definition of UNCHASTE. : not chaste : lacking in chastity. — un·chaste·ly adverb. — un·chaste·ness \-ˈchās(t)-nəs\ noun.
unchastened,adjective,(of a person) not restrained or subdued.
unchasteness,,Definition of UNCHASTE. : not chaste : lacking in chastity. — un·chaste·ly adverb. — un·chaste·ness \-ˈchās(t)-nəs\ noun.
unchastity,,"not chaste; not virtuous; not pure: an unchaste woman. characterized by sexual suggestiveness, transgression, or excess; lascivious; bawdy:"
unchastities,,"not chaste; not virtuous; not pure: an unchaste woman. characterized by sexual suggestiveness, transgression, or excess; lascivious; bawdy:"
unchecked,adjective,(especially of something undesirable) not controlled or restrained.
unchivalrous,adjective,"(of a man or his behaviour) discourteous, especially towards women."
unchosen,adjective,not chosen.
unchristian,adjective,not professing Christianity or its teachings.
unchurched,adjective,not belonging to or connected with a Church.
uncial,adjective,of or written in a majuscule script with rounded unjoined letters which is found in European manuscripts of the 4th–8th centuries and from which modern capital letters are derived.
uncials,noun,an uncial letter or script.
uncinate,adjective,having a hooked shape.
uncircumcised,adjective,(of a boy or man) not circumcised.
uncivil,adjective,discourteous; impolite.
uncivilized,adjective,"(of a place or people) not socially, culturally, or morally advanced."
unclad,adjective,unclothed; naked.
unclaimed,adjective,not demanded or requested as being something one has a right to.
unclasp,verb,unfasten (something fastened with a clasp or similar device).
unclasped,verb,unfasten (something fastened with a clasp or similar device).
unclasping,verb,unfasten (something fastened with a clasp or similar device).
unclasps,verb,unfasten (something fastened with a clasp or similar device).
unclassifiable,adjective,not able to be assigned to a particular class or category.
unclassified,adjective,not arranged in or assigned to classes or categories.
uncle,noun,the brother of one's father or mother or the husband of one's aunt.
unclean,adjective,morally wrong.
unclean,adjective,dirty.
uncleaned,,Full Definition of UNCLEAN. 1. : morally or spiritually impure. 2. : infected with a harmful supernatural contagion; also : prohibited by ritual law for use or contact.
uncleanly,adjective,archaic term for unclean.
uncleanliness,noun,the state of being dirty.
uncleanness,,Full Definition of UNCLEAN. 1. : morally or spiritually impure. 2. : infected with a harmful supernatural contagion; also : prohibited by ritual law for use or contact.
unclear,adjective,"not easy to see, hear, or understand."
uncleared,adjective,(of land) not cleared of vegetation before cultivation.
unclearer,adjective,"not easy to see, hear, or understand."
unclehood,,Words near unclehood in the dictionary. uncleavable. uncleaved. uncledom. uncleft.
unclench,verb,release (a clenched part of the body).
unclenched,verb,release (a clenched part of the body).
unclenches,verb,release (a clenched part of the body).
unclenching,verb,release (a clenched part of the body).
uncles,noun,the brother of one's father or mother or the husband of one's aunt.
uncloak,verb,uncover; reveal.
uncloaked,verb,uncover; reveal.
uncloaking,verb,uncover; reveal.
uncloaks,verb,uncover; reveal.
unclog,verb,remove accumulated matter from (a drain or other channel).
unclogged,verb,"block or become blocked with an accumulation of thick, wet matter."
unclogging,verb,remove accumulated matter from (a drain or other channel).
unclogs,verb,remove accumulated matter from (a drain or other channel).
unclose,verb,open.
unclosed,adjective,not closed.
uncloses,verb,open.
unclosing,verb,open.
unclothe,verb,remove the clothes from (oneself or someone else).
unclothed,verb,remove the clothes from (oneself or someone else).
unclothed,adjective,not wearing clothes; naked.
unclothes,verb,remove the clothes from (oneself or someone else).
unclothing,verb,remove the clothes from (oneself or someone else).
unclouded,adjective,(of the sky) not dark or overcast.
unclouding,,Definition of UNCLOUDED. : not covered by clouds : not darkened or obscured : clear. — un·cloud·ed·ly adverb.
uncluttered,adjective,"not having or impeded by too many objects, details, or elements."
unco,adjective,unusual or remarkable.
unco,adverb,remarkably; very.
unco,noun,a stranger.
uncoated,adjective,not covered with a coating of a particular substance.
uncoil,verb,straighten or cause to straighten from a coiled or curled position.
uncoiled,verb,straighten or cause to straighten from a coiled or curled position.
uncoiling,verb,straighten or cause to straighten from a coiled or curled position.
uncoils,verb,straighten or cause to straighten from a coiled or curled position.
uncollected,adjective,not collected or claimed.
uncolored,adjective,having no colour; neutral in colour.
uncoloured,adjective,having no colour; neutral in colour.
uncoloured,adjective,"not influenced, especially in a negative way."
uncombed,adjective,(of a person's hair) not combed.
uncombined,adjective,not joined or merged to form a single unit or substance.
uncomfortable,adjective,causing or feeling slight pain or physical discomfort.
uncomfortableness,,"uncomfortable. adj. early 15c. ""causing discomfort,"" from un- (1) ""not"" + comfortable. Meaning ""feeling discomfort, ill-at-ease"" is attested from 1796. Related: Uncomfortably."
uncomfortably,,Definition of UNCOMFORTABLE for Kids. 1. : causing discomfort or uneasiness <an uncomfortable chair> <an uncomfortable silence> 2. : feeling discomfort or uneasiness <His staring made me uncomfortable.>
uncomforted,adjective,causing or feeling slight pain or physical discomfort.
uncommercial,adjective,"not making, intended to make, or allowing a profit."
uncommitted,adjective,"not committed to a cause, activity, etc."
uncommon,adjective,out of the ordinary; unusual.
uncommon,adverb,remarkably.
uncommonly,adverb,exceptionally; very.
uncommonness,noun,the state of being rare or unusual.
uncommunicated,adjective,not expressed or revealed; secret.
uncommunicative,adjective,unwilling to talk or impart information.
uncompassionate,adjective,not showing compassion or sympathy for other people.
uncompensated,adjective,(of a person or expense) not compensated or reimbursed.
uncompetitive,adjective,not competitive.
uncomplaining,adjective,not complaining; resigned.
uncomplainingly,,: not complaining : patient <uncomplaining acceptance> — un·com·plain·ing·ly \-niŋ-lē\ adverb. See uncomplaining defined for English-language learners. See uncomplaining defined for kids.
uncompleted,adjective,not completed.
uncomplicated,adjective,simple or straightforward.
uncomplimentary,adjective,not complimentary; negative or insulting.
uncompounded,adjective,not mixed.
uncomprehended,,Full Definition of UNCOMPREHENDING. : not comprehending : lacking understanding. — un·com·pre·hend·ing·ly \-diŋ-lē\ adverb. See uncomprehending defined for English-language learners.
uncomprehending,adjective,showing or having an inability to comprehend something.
uncomprehendingly,,Full Definition of UNCOMPREHENDING. : not comprehending : lacking understanding. — un·com·pre·hend·ing·ly \-diŋ-lē\ adverb. See uncomprehending defined for English-language learners.
uncompressed,adjective,(of data) not compressed.
uncompromising,adjective,"showing an unwillingness to make concessions to others, especially by changing one's ways or opinions."
uncompromisingly,,"Full Definition of UNCOMPROMISING. : not making or accepting a compromise : making no concessions : inflexible, unyielding. — un·com·pro·mis·ing·ly \-ziŋ-lē\ adverb. — un·com·pro·mis·ing·ness \-nəs\ noun."
unconcealed,adjective,(especially of an emotion) not concealed; obvious.
unconceded,verb,admit or agree that something is true after first denying or resisting it.
unconceded,verb,"surrender or yield (a possession, right, or privilege)."
unconcern,noun,"a lack of worry or interest, especially when surprising or callous."
unconcerned,adjective,"showing a lack of worry or interest, especially when this is surprising or callous."
unconcernedly,,"2. : not anxious or upset : free of worry. — un·con·cerned·ly \-ˈsər-nəd-lē, -ˈsərnd-lē\ adverb. — un·con·cerned·ness \-ˈsər-nəd-nəs, -ˈsərn(d)-nəs\ noun. See unconcerned defined for English-language learners."
unconcluded,adjective,not yet brought to a conclusion.
uncondensed,adjective,not changed from a gas or vapour to a liquid.
unconditional,adjective,not subject to any conditions.
unconditionally,,"In this question, unconditional is an adjective that means not modified or restricted by reservations. Whether it's love, support, or surrender, if something's unconditional it's absolute and not subject to any special terms or conditions: it'll happen no matter what else happens."
unconditioned,adjective,not subject to conditions or to an antecedent condition; unconditional.
unconfessed,adjective,not acknowledged.
unconfident,adjective,not confident; hesitant.
unconfined,adjective,not confined to a limited space.
unconfirmed,adjective,not confirmed as to truth or validity.
unconformable,adjective,"(of rock strata in contact) marking a discontinuity in the geological record, and typically not having the same direction of stratification."
unconforming,adjective,failing or refusing to conform.
uncongenial,adjective,(of a person) not friendly or pleasant to be with.
unconnected,adjective,not joined together or to something else.
unconnected,adjective,not associated or linked in a sequence.
unconquerable,adjective,"(especially of a place, people, or emotion) not conquerable."
unconquerably,adjective,"(especially of a place, people, or emotion) not conquerable."
unconquered,adjective,not conquered.
unconscientious,,Definition of UNCONSCIENTIOUS. : not conscientious. — un·con·sci·en·tious·ly adverb. — un·con·sci·en·tious·ness noun.
unconscientiously,,Definition of UNCONSCIENTIOUS. : not conscientious. — un·con·sci·en·tious·ly adverb. — un·con·sci·en·tious·ness noun.
unconscionable,adjective,not right or reasonable.
unconscionably,,"Full Definition of UNCONSCIONABLE. 1. : not guided or controlled by conscience : unscrupulous <an unconscionable villain> a : excessive, unreasonable <found an unconscionable number of defects in the car> b : shockingly unfair or unjust <unconscionable sales practices>"
unconscious,adjective,not awake and aware of and responding to one's environment.
unconscious,adjective,done or existing without one realizing.
unconscious,noun,the part of the mind which is inaccessible to the conscious mind but which affects behaviour and emotions.
unconsciously,,"not perceived at the level of awareness; occurring below the level of conscious thought: an unconscious impulse. not consciously realized, planned, or done; without conscious volition or intent: an unconscious social slight. 5."
unconsciousness,noun,the state of being unconscious.
unconsecrated,adjective,not consecrated.
unconsenting,adjective,not consenting.
unconsidered,adjective,disregarded and unappreciated.
unconsolidated,adjective,not consolidated.
unconstitutional,adjective,not in accordance with the political constitution or with procedural rules.
unconstrained,adjective,not restricted or limited.
unconstricted,adjective,not constricted.
unconsumed,adjective,(especially of food or fuel) not consumed.
unconsummated,adjective,(of a marriage or other relationship) not having been consummated.
uncontainable,adjective,(especially of an emotion) very strong.
uncontaminated,adjective,not contaminated.
uncontested,adjective,not contested.
uncontradicted,adjective,(of a statement) not contradicted.
uncontrived,adjective,not appearing artificial.
uncontrollable,adjective,not controllable.
uncontrollably,,: incapable of being controlled : ungovernable uncontrollable emotions> — un·con·trol·la·bil·i·ty \-ˌtrō-lə-ˈbi-lə-tē\ noun. — un·con·trol·la·bly \-ˈtrō-lə-blē\ adverb. See uncontrollable defined for English-language learners.
uncontrolled,adjective,not controlled.
uncontroversial,adjective,not controversial.
unconventional,adjective,not based on or conforming to what is generally done or believed.
unconventionality,adjective,not based on or conforming to what is generally done or believed.
unconventionally,,"In this question, unconventional is an adjective that means not conforming to standards. To be unconventional is to act, dress, speak, or otherwise exist out of the bounds of cultural norms. If you eat cheeseburgers for breakfast, that's somewhat unconventional."
unconversant,,Definition of “unconversant” Collins English Dictionary. unconversant.
unconverted,adjective,(of a building) not adapted to a different use.
unconvertible,,"In this question, hectic is an adjective that means marked by intense agitation or emotion. Definitions of unconvertible."
