u,noun,the twenty-first letter of the alphabet.
uberrima,,"<b>Uberrima</b> fides (sometimes seen in its genitive form uberrimae fidei) is a Latin phrase meaning ""utmost good faith"" (literally, ""most abundant faith""). It is the name of a legal doctrine which governs insurance contracts."
uberties,,"<b>Meaning</b>: No, we didn't forget the P in our Good Word today; <b>uberty</b> is its own word. It <b>means</b> 1. abundance, copiousness and 2. fruitfulness, fertility. Notes: Today's Good Word is the noun derived from the adjective uberous ""abundant, copious""."
ubiquity,,<b>Definition</b> of <b>UBIQUITY</b>. : presence everywhere or in many places especially simultaneously : omnipresence.
ubiquities,,"<b>Ubiquity</b> is the state of being everywhere all the time. Some <b>ubiquity</b> is real (the <b>ubiquity</b> of sadness at a funeral), and some only seems real (the <b>ubiquity</b> of cowboy boots in Texas). A god is a great example of <b>ubiquity</b>: an all-knowing deity that exists in every nook and cranny."
ubiquitous,adjective,"present, appearing, or found everywhere."
ubiquitously,,Full <b>Definition</b> of <b>UBIQUITOUS</b>. : existing or being everywhere at the same time : constantly encountered : widespread &lt;a <b>ubiquitous</b> fashion&gt; — ubiq·ui·tous·ly adverb. — ubiq·ui·tous·ness noun.
udder,noun,"the mammary gland of female cattle, sheep, goats, horses, and related ungulates, hanging near the hind legs as a bag-like organ with two or more teats."
udders,noun,"the mammary gland of female cattle, sheep, goats, horses, and related ungulates, hanging near the hind legs as a bag-like organ with two or more teats."
ufo,noun,"a mysterious object seen in the sky for which it is claimed no orthodox scientific explanation can be found, often supposed to be a vehicle carrying extraterrestrials."
ufos,noun,"a mysterious object seen in the sky for which it is claimed no orthodox scientific explanation can be found, often supposed to be a vehicle carrying extraterrestrials."
ugh,exclamation,used to express disgust or horror.
ughs,,"interjection. (used as an exclamation expressing disgust, aversion, horror, or the like). noun. the sound of a cough, grunt, or the like. Examples from the Web for ugh Expand."
ugly,adjective,"unpleasant or repulsive, especially in appearance."
ugly,adjective,involving or likely to involve violence or other unpleasantness.
uglier,adjective,"unpleasant or repulsive, especially in appearance."
uglier,adjective,involving or likely to involve violence or other unpleasantness.
ugliest,adjective,"unpleasant or repulsive, especially in appearance."
ugliest,adjective,involving or likely to involve violence or other unpleasantness.
uglify,,<b>Definition</b> of <b>UGLIFY</b>. transitive verb. : to make ugly. — ug·li·fi·ca·tion \ˌə-gli-fə-ˈkā-shən\ noun. See <b>uglify defined</b> for kids.
uglifying,,<b>Definition</b> of <b>UGLIFY</b>. transitive verb. : to make ugly. — ug·li·fi·ca·tion \ˌə-gli-fə-ˈkā-shən\ noun. See <b>uglify defined</b> for kids.
uglily,,very unattractive or unpleasant to look at; offensive to the sense of beauty; displeasing in appearance.
ugliness,,"of unpleasant or unsightly appearance. repulsive, objectionable, or displeasing in any way: war is <b>ugly</b>. ominous or menacing: an <b>ugly</b> situation. bad-tempered, angry, or sullen: an <b>ugly</b> mood."
uh,exclamation,used to express hesitation.
uhs,,"An SDXC <b>UHS</b>-I card will work in any SDXC compatible device at lower speeds, but to take advantage of the <b>UHS</b>-I speed, a <b>UHS</b>-I compatible device is essential. <b>UHS</b>-I compatible cards and devices are normally marked with the symbol below ,""<b>UHS</b>-I"" or ""I"" A speed class is also <b>defined</b>. = Class 1 ."""
ukase,noun,(in tsarist Russia) a decree with the force of law.
ukases,noun,(in tsarist Russia) a decree with the force of law.
uke,noun,short for ukulele.
ukelele,noun,a small four-stringed guitar of Hawaiian origin.
ukeleles,noun,a small four-stringed guitar of Hawaiian origin.
ukes,noun,short for ukulele.
ukrainian,noun,"a native or inhabitant of Ukraine, or a person of Ukrainian descent."
ukrainians,noun,"a native or inhabitant of Ukraine, or a person of Ukrainian descent."
ukulele,noun,a small four-stringed guitar of Hawaiian origin.
ukuleles,noun,a small four-stringed guitar of Hawaiian origin.
ulcer,noun,"an open sore on an external or internal surface of the body, caused by a break in the skin or mucous membrane which fails to heal. Ulcers range from small, painful sores in the mouth to bedsores and serious lesions of the stomach or intestine."
ulcerate,verb,develop into or become affected by an ulcer.
ulcerated,verb,develop into or become affected by an ulcer.
ulcerates,verb,develop into or become affected by an ulcer.
ulcerating,verb,develop into or become affected by an ulcer.
ulceration,,"<b>Ulcer</b>: A lesion that is eroding away the skin or mucous membrane. <b>Ulcers</b> can have various causes, depending on their location. <b>Ulcers</b> on the skin are usually due to irritation, as in the case of bedsores, and may become inflamed and/or infected as they grow."
ulcerations,,": the process of becoming <b>ulcerated</b> : the state of being <b>ulcerated</b>. : ulcer. — ul·cer·a·tive \ˈəl-sə-ˌrā-tiv, ˈəls-rə-, ˈəl-sə-rə-\ adjective. See <b>ulceration defined</b> for kids."
ulcerative,,<b>Ulcerative</b> colitis (UL-sur-uh-tiv koe-LIE-tis) is an inflammatory bowel disease (IBD) that causes long-lasting inflammation and ulcers (sores) in your digestive tract. <b>Ulcerative</b> colitis affects the innermost lining of your large intestine (colon) and rectum.
ulcered,verb,develop into or become affected by an ulcer.
ulcering,,"Full <b>Definition</b> of <b>ULCER</b>. 1. : a break in skin or mucous membrane with loss of surface tissue, disintegration and necrosis of epithelial tissue, and often pus. : something that festers and corrupts like an open sore. — <b>ulcer</b> verb."
ulcerous,adjective,having or constituting an ulcer.
ulcers,noun,"an open sore on an external or internal surface of the body, caused by a break in the skin or mucous membrane which fails to heal. Ulcers range from small, painful sores in the mouth to bedsores and serious lesions of the stomach or intestine."
ule,suffix,"forming diminutive nouns such as capsule, pustule."
ulla,,<b>Ulla</b> is a feminine given name. It is short for Ursula in German-speaking countries and Ulrika in Scandinavian countries.
ullage,noun,the amount by which a container falls short of being full.
ullages,,"By an obvious extension, <b>ullage</b> came to refer to any amount by which a barrel is unfilled, perhaps because some of the contents have been used. It is also applied to the unfilled air space at the top of a bottle of wine, which in this case is essential to allow for expansion of the contents as the temperature changes."
ulna,noun,"the thinner and longer of the two bones in the human forearm, on the side opposite to the thumb."
ulnae,noun,"the thinner and longer of the two bones in the human forearm, on the side opposite to the thumb."
ulnar,,Medical <b>Definition</b> of <b>ULNA</b>. : the bone on the little-finger side of the human forearm that forms with the humerus the elbow joint and serves as a pivot in rotation of the hand.
ulnas,noun,"the thinner and longer of the two bones in the human forearm, on the side opposite to the thumb."
ulster,noun,"a man's long, loose overcoat of rough cloth, typically with a belt at the back."
ulsters,noun,"a man's long, loose overcoat of rough cloth, typically with a belt at the back."
ultimate,noun,a final or fundamental fact or principle.
ultimate,adjective,being or happening at the end of a process; final.
ultimate,adjective,being the best or most extreme example of its kind.
ultimate,noun,the best achievable or imaginable of its kind.
ultimately,adverb,finally; in the end.
ultimatum,noun,"a final demand or statement of terms, the rejection of which will result in retaliation or a breakdown in relations."
ultra,noun,an extremist.
ultra,prefix,to an extreme degree; very.
ultra,prefix,beyond; on the other side of.
ultramarine,noun,"a brilliant deep blue pigment originally obtained from lapis lazuli, now made from powdered fired clay, sodium carbonate, sulphur, and resin."
ululate,verb,"howl or wail as an expression of strong emotion, typically grief."
ululated,verb,"howl or wail as an expression of strong emotion, typically grief."
ululates,verb,"howl or wail as an expression of strong emotion, typically grief."
ululating,verb,"howl or wail as an expression of strong emotion, typically grief."
ululation,,"In this question, <b>ululation</b> is a noun that means a long loud emotional utterance. <b>Ululation</b> is a howling or wailing sound. In many cultures, the sound of <b>ululation</b> is common at a funeral, while in others the mourners only sniffle quietly."
ululations,,"A <b>ululation</b> (pronunciation: <sup>i</sup>/ˌʲuːl.juː.ˈleɪ.ʃən/) is a long, wavering, high-pitched vocal sound resembling a howl with a trilling quality. It is produced by emitting a high pitched loud voice accompanied with a rapid movement of the tongue and the uvula."
ulus,noun,an Eskimo woman's short-handled knife with a broad crescent-shaped blade.
um,exclamation,expressing hesitation or a pause in speech.
umbel,noun,"a flower cluster in which stalks of nearly equal length spring from a common centre and form a flat or curved surface, characteristic of the parsley family."
umbeled,,"An <b>umbel</b> is an inflorescence which consists of a number of short flower stalks (called pedicels) which spread from a common point, somewhat like umbrella ribs. The word was coined in botany in the 1590s, from Latin umbella ""parasol, sunshade."""
umbellate,,"<b>Definition</b> of <b>UMBELLATE</b>. 1. : bearing, consisting of, or arranged in umbels. : resembling an umbel in form."
umbels,noun,"a flower cluster in which stalks of nearly equal length spring from a common centre and form a flat or curved surface, characteristic of the parsley family."
umber,noun,"a natural pigment resembling but darker than ochre, normally dark yellowish-brown in colour ( raw umber ) or dark brown when roasted ( burnt umber )."
umbered,,Full <b>Definition</b> of <b>UMBER</b>. 1. : a brown earth that is darker in color than ocher and sienna because of its content of manganese and iron oxides and is highly valued as a permanent pigment either in the raw or burnt state. 2. a : a moderate to dark yellowish brown.
umbers,noun,"a natural pigment resembling but darker than ochre, normally dark yellowish-brown in colour ( raw umber ) or dark brown when roasted ( burnt umber )."
umbilical,adjective,relating to or affecting the navel or umbilical cord.
umbles,noun,"the entrails of an animal, especially a deer, as used for food."
umbra,noun,"the fully shaded inner region of a shadow cast by an opaque object, especially the area on the earth or moon experiencing the total phase of an eclipse."
umbrae,noun,"the fully shaded inner region of a shadow cast by an opaque object, especially the area on the earth or moon experiencing the total phase of an eclipse."
umbrage,noun,offence or annoyance.
umbras,noun,"the fully shaded inner region of a shadow cast by an opaque object, especially the area on the earth or moon experiencing the total phase of an eclipse."
umbrella,noun,"a device consisting of a circular canopy of cloth on a folding metal frame supported by a central rod, used as protection against rain."
umbrella,noun,a protecting force or influence.
umbrellas,noun,a protecting force or influence.
umbrellas,noun,"a device consisting of a circular canopy of cloth on a folding metal frame supported by a central rod, used as protection against rain."
umbriferous,adjective,providing shade.
umbrous,adjective,shady.
umiak,noun,"an Eskimo open boat made of wood and skin, traditionally rowed by women."
umiaks,noun,"an Eskimo open boat made of wood and skin, traditionally rowed by women."
umlaut,noun,"a mark (¨) used over a vowel, especially in German, to indicate a different vowel quality."
umlauted,verb,modify (a form or sound) by using an umlaut.
umlauting,verb,modify (a form or sound) by using an umlaut.
umlauts,noun,"a mark (¨) used over a vowel, especially in German, to indicate a different vowel quality."
ump,noun,an umpire.
umping,,"ump. noun. Sports. A person, usually appointed, who decides the issues or results, or supervises the conduct, of a competition or conflict: arbiter, arbitrator, judge, referee, umpire."
umpire,noun,(in some sports) an official who watches a game or match closely to enforce the rules and arbitrate on matters arising from the play.
umpire,verb,act as an umpire in a game or match.
umpired,verb,act as an umpire in a game or match.
umpires,noun,(in some sports) an official who watches a game or match closely to enforce the rules and arbitrate on matters arising from the play.
umpires,verb,act as an umpire in a game or match.
umpiring,verb,act as an umpire in a game or match.
umps,noun,an umpire.
umpteen,number,indefinitely many; a lot of.
umpteenth,,"if something happens for the <b>umpteenth</b> time, it happens again after having happened many times before - used when you are annoyed that it has happened so often : 'This is crazy,' she told herself for the <b>umpteenth</b> time. <b>Dictionary</b> results for ""<b>umpteenth</b>"""
umteenth,,"adjective, Informal. of an indefinitely large number in succession: He was the umpteenth person to arrive. Also, umteenth."
un,contraction,one.
unabashed,adjective,"not embarrassed, disconcerted, or ashamed."
unabashedly,,"Full Definition of UNABASHED. : not abashed : undisguised, unapologetic. — un·abash·ed·ly \-ˈbash-əd-lē\ adverb. See unabashed defined for English-language learners. See unabashed defined for kids."
unabated,adjective,without any reduction in intensity or strength.
unabating,adjective,not weakening or losing intensity.
unable,adjective,"lacking the skill, means, or opportunity to do something."
unabridged,adjective,(of a text) not cut or shortened; complete.
unabsolved,,Next Word in the Dictionary: unabsorbablePrevious Word in the Dictionary: unabridgedAll Words Near: unabsolved.
unabsorbed,adjective,not taken in or soaked up; not absorbed.
unacademic,adjective,not adopting or characteristic of a scholarly approach or language.
unaccented,adjective,"having no accent, stress, or emphasis."
unacceptable,adjective,not satisfactory or allowable.
unacclaimate,verb,acclimatize.
unacclimatized,,Words near unacclimatized in the dictionary. unaccessioned. unacclaimed. unacclimated. unacclimatised.
unaccommodating,adjective,not fitting in with the wishes or demands of others; unhelpful.
unaccompanied,adjective,having no companion or escort.
unaccompanied,adjective,taking place without something specified taking place at the same time.
unaccomplished,adjective,showing little skill.
unaccomplished,adjective,not accomplished or carried out.
unaccountability,,"Full Definition of UNACCOUNTABLE. 1. : not to be accounted for : inexplicable, strange. : not to be called to account : not responsible."
unaccountable,adjective,unable to be explained.
unaccountable,adjective,"(of a person, organization, or institution) not required or expected to justify actions or decisions; not responsible for results or consequences."
unaccounted,adjective,not included in (an account or calculation) through being lost or disregarded.
unaccredited,adjective,not recognized as having attained an acceptable standard.
unaccustomed,adjective,not familiar or usual; out of the ordinary.
unachievable,adjective,(of an aim or objective) too difficult to be achieved.
unacknowledged,adjective,"existing or having taken place but not accepted, recognized, or admitted to."
unacknowledging,adjective,"existing or having taken place but not accepted, recognized, or admitted to."
unacquainted,adjective,(of two or more people) not having met before; not knowing each other.
unadaptable,adjective,not adaptable.
unadapted,adjective,not adapted.
unaddressed,adjective,not considered or dealt with.
unadjusted,adjective,(especially of figures or statistics) not adjusted or refined.
unadorned,adjective,not adorned; plain.
unadulterated,adjective,(especially of food or drink) having no inferior added substances; pure.
unadulterated,adjective,not mixed or diluted with any different or extra elements; complete and absolute.
unadventurous,adjective,"not offering, involving, or eager for new or stimulating things."
unadvertised,adjective,existing or taking place without being made public.
unadvisable,adjective,likely to have unfortunate consequences; unwise.
unadvised,,: not prudent : ill-advised unadvised haste> — un·ad·vis·ed·ly \-ˈvī-zəd-lē\ adverb. See unadvised defined for kids.
unadvisedly,adverb,in an unwise or rash manner.
unaesthetic,adjective,not visually pleasing; unattractive.
unaffected,adjective,feeling or showing no effects or changes.
unaffected,adjective,without artificiality or insincerity.
unaffectedly,,"Full Definition of UNAFFECTED. 1. : not influenced or changed mentally, physically, or chemically. 2. : free from affectation : genuine."
unaffectionate,adjective,"feeling, showing, or having no fondness or tenderness."
unaffiliated,adjective,not officially attached to or connected with an organization or group.
unafraid,adjective,feeling no fear or anxiety.
unaged,,"It comes unaged (blanco), slightly aged or ""rested"" in oak (reposado), or aged at least a year in oak barrels (aneio). Jequile 101 by Sunset. American Born Moonshine Original is a 103-proof, unaged corn whiskey made from a blend of corn, sugar and water."
unaggressive,adjective,tending not to attack without provocation; not hostile or violent.
unaided,adjective,needing or having no assistance; without help.
unaired,adjective,not exposed to the open air for ventilation.
unalarmed,adjective,not anxious or concerned.
unalienable,adjective,another term for inalienable.
unalienated,,"to turn away; transfer or divert: to alienate funds from their intended purpose. Law. to transfer or convey, as title, property, or other right, to another: to alienate lands."
unaligned,adjective,"not placed or arranged in a straight line, in parallel, or in correct relative positions."
unalike,adjective,(of two or more subjects) differing from each other; not similar.
unallayed,,Definition of “unallayed” Collins English Dictionary. unallayed.
unalleviated,adjective,not alleviated; relentless.
unallied,adjective,not allied; having no allies.
unallocated,adjective,(of resources or duties) not yet allocated.
unalloyed,adjective,(of metal) not alloyed; pure.
unalloyed,adjective,(chiefly of emotions) complete and unreserved.
unallowable,adjective,not allowable.
unalterable,adjective,not able to be changed.
unaltered,adjective,remaining the same; unchanged.
unaltering,adjective,not faltering; steady; resolute.
unambiguous,adjective,not open to more than one interpretation.
unambiguously,,"Full Definition of UNAMBIGUOUS. : not ambiguous : clear, precise <unambiguous evidence> — un·am·big·u·ous·ly adverb."
unambitious,adjective,not motivated or driven by a strong desire or determination to succeed.
unamenable,adjective,not responsive to something; not capable of being treated or dealt with in a particular way.
unamiable,adjective,not having a friendly manner; not pleasant.
unamortized,,"The unamortized bond discount is the difference between the par of a bond - the value of the bond at maturity - and the proceeds from the sale of the bond by the issuing company, less the portion that has already been amortized on the profit and loss statement."
unamused,adjective,not responding in a positive way to something intended to be amusing; feeling somewhat annoyed or disapproving.
unanchored,adjective,not anchored or securely fixed.
unanimated,adjective,lacking excitement or vitality; dull.
unanimity,noun,agreement by all people involved; consensus.
unanimities,adjective,(of two or more people) fully in agreement.
unanimous,adjective,(of two or more people) fully in agreement.
unanimously,adverb,without opposition; with the agreement of all people involved.
unannounced,adjective,not made known; not publicized.
unanswerable,adjective,unable to be answered.
unanswered,adjective,not answered or responded to.
unanticipated,adjective,not expected or predicted.
unapologetic,adjective,not acknowledging or expressing regret.
unapologetically,,"Full Definition of UNAPOLOGETIC. : not apologetic : offered, put forward, or being such without apology or qualification <an unapologetic liberal> — un·apol·o·get·i·cal·ly \-ti-k(ə-)lē\ adverb."
unapparent,adjective,not visible or in evidence.
unappealable,adjective,(of a case or ruling) not subject to being referred to a higher court for review.
unappealing,adjective,not inviting or attractive.
unappeasable,adjective,"not able to be pacified, placated, or satisfied."
unappeased,adjective,"not pacified, placated, or satisfied."
unappetizing,adjective,not inviting or attractive; unwholesome.
unapplicable,adjective,not relevant or appropriate.
unapplied,adjective,not applied.
unappreciated,adjective,"not fully understood, recognized, or valued."
unappreciative,adjective,"not fully understanding, recognizing, or valuing something."
unapprehensive,adjective,anxious or fearful that something bad or unpleasant will happen.
unapproachable,adjective,not welcoming or friendly.
unappropriated,adjective,"not taken, allocated, or assigned."
unapproved,adjective,not officially accepted or sanctioned.
unapt,adjective,not appropriate or suitable in the circumstances.
unarguable,adjective,not open to disagreement; indisputable.
unary,adjective,(especially of a mathematical operation) consisting of or involving a single component or element.
unarm,verb,deprive or free (someone) of arms or armour.
unarmed,verb,deprive or free (someone) of arms or armour.
unarmed,adjective,not equipped with or carrying weapons.
unarms,verb,deprive or free (someone) of arms or armour.
unarranged,adjective,"not placed in a neat, attractive, or required order."
unarticulated,adjective,not mentioned or coherently expressed.
unartistic,adjective,not artistic or concerned with art.
unascertained,adjective,not confirmed or ascertained; unknown.
unashamed,adjective,expressed or acting openly and without guilt or embarrassment.
unasked,adjective,(of a question) not asked.
unaspirated,adjective,(of a sound) not aspirated.
unassailable,adjective,"unable to be attacked, questioned, or defeated."
unassailably,adjective,"unable to be attacked, questioned, or defeated."
unassertive,adjective,(of a person) not having or showing a confident and forceful personality.
unassigned,adjective,not allocated or set aside for a specific purpose.
unassimilated,adjective,"(especially of a people, an idea, or a culture) not absorbed or integrated into a wider society or culture."
unassisted,adjective,not helped by anyone or anything.
unassociated,adjective,not connected or associated.
unassorted,,"Charities and the Commons: The Pittsburgh Survey, Part II: The Place Various. Out of sorts means mixed, unclassified, unassorted, having one's functions disordered."
unassuming,adjective,not pretentious or arrogant; modest.
unassumingly,,"unassuming. Add to List... The word unassuming means modest, lacking in arrogance, pleasant, or polite. You'll find that some of the most unassuming people are actually the most interesting and powerful of all."
unassured,,Definition of UNASSURED. 1. : unsafe. : not assured : lacking boldness or confidence.
unattached,adjective,not working for or belonging to a particular body or organization.
unattached,adjective,not married or having an established partner; single.
unattainable,adjective,not able to be reached or achieved.
unattempted,adjective,not previously attempted or embarked upon; untried.
unattended,adjective,not noticed or dealt with.
unattended,adjective,not supervised or looked after.
unattested,adjective,not attested or recorded.
unattracted,,"Full Definition of UNATTRACTIVE. : not attractive : plain, dull. — un·at·trac·tive·ly adverb. — un·at·trac·tive·ness noun. See unattractive defined for English-language learners."
unattractive,adjective,not pleasing or appealing to look at.
unattributed,adjective,"(of a quotation, story, or work of art) not ascribed to any source; of unknown or unpublished provenance."
unauspicious,,Next Word in the Dictionary: unauthenticatedPrevious Word in the Dictionary: unaugmentedAll Words Near: unauspicious.
unauthentic,adjective,not made or done in a way that reflects tradition or faithfully resembles an original.
unauthenticated,adjective,not proven or validated.
unauthorized,adjective,not having official permission or approval.
unavailable,adjective,not able to be used or obtained; not at someone's disposal.
unavailable,adjective,(of a person) not free to do something; otherwise occupied.
unavailing,adjective,achieving little or nothing; ineffective.
unavailingly,,"Full Definition of UNAVAILING. : not availing : futile, useless. — un·avail·ing·ly \-liŋ-lē\ adverb. — un·avail·ing·ness noun. See unavailing defined for English-language learners."
unavenged,adjective,"(of a person, injury, or wrong) not avenged."
unavoidable,adjective,"not able to be avoided, prevented, or ignored; inevitable."
unavoidably,,Full Definition of UNAVOIDABLE. : not avoidable : inevitable <the accident was unavoidable> — un·avoid·ably \-blē\ adverb. See unavoidable defined for English-language learners.
